Symbol,Company_Name,Sector,Data_Exising,History_Existing
A,Agilent Technologies Inc. Common Stock,Industrials,True,6225.0
AA,Alcoa Corporation Common Stock ,Industrials,True,6225.0
AACG,ATA Creativity Global American Depositary Shares,Real Estate,True,4197.0
AACT,Ares Acquisition Corporation II Class A Ordinary Shares,Finance,True,327.0
AADI,Aadi Bioscience Inc. Common Stock,Health Care,True,1665.0
AAL,American Airlines Group Inc. Common Stock,Consumer Discretionary,True,4784.0
AAME,Atlantic American Corporation Common Stock,Finance,True,6225.0
AAN,Aarons Holdings Company Inc. Common Stock ,Consumer Discretionary,True,966.0
AAOI,Applied Optoelectronics Inc. Common Stock,Technology,True,2771.0
AAON,AAON Inc. Common Stock,Industrials,True,6225.0
AAP,Advance Auto Parts Inc.,Consumer Discretionary,True,5747.0
AAPL,Apple Inc. Common Stock,Technology,True,6225.0
AAT,American Assets Trust Inc. Common Stock,Real Estate,True,3450.0
AB,AllianceBernstein Holding L.P.  Units,Finance,True,6225.0
ABAT,American Battery Technology Company Common Stock,Basic Materials,True,2165.0
ABBV,AbbVie Inc. Common Stock,Health Care,True,2956.0
ABCB,Ameris Bancorp Common Stock,Finance,True,6225.0
ABCL,AbCellera Biologics Inc. Common Shares,Health Care,True,955.0
ABEO,Abeona Therapeutics Inc. Common Stock,Health Care,True,6225.0
ABEV,Ambev S.A. American Depositary Shares (Each representing 1 Common Share),Consumer Staples,True,6225.0
ABG,Asbury Automotive Group Inc Common Stock,Consumer Discretionary,True,5671.0
ABL,Abacus Life Inc. Class A Common Stock,Finance,True,1018.0
ABLLL,Abacus Life Inc. 9.875% Fixed Rate Senior Notes due 2028,Finance,True,213.0
ABLV,Able View Global Inc. Class B Ordinary Shares,Consumer Discretionary,True,270.0
ABM,ABM Industries Incorporated Common Stock,Finance,True,6225.0
ABNB,Airbnb Inc. Class A Common Stock,Finance,True,956.0
ABOS,Acumen Pharmaceuticals Inc. Common Stock,Health Care,True,817.0
ABR,Arbor Realty Trust Common Stock,Real Estate,True,5155.0
ABSI,Absci Corporation Common Stock,Health Care,True,803.0
ABT,Abbott Laboratories Common Stock,Health Care,True,6225.0
ABTS,Abits Group Inc Ordinary Shares,Technology,True,2636.0
ABUS,Arbutus Biopharma Corporation Common Stock,Health Care,True,4325.0
ABVC,ABVC BioPharma Inc. Common Stock,Health Care,True,5005.0
ABVE,Above Food Ingredients Inc. Common Stock,Consumer Staples,True,63.0
ABVX,Abivax SA American Depositary Shares,Health Care,True,237.0
AC,Associated Capital Group Inc. Common Stock,Finance,True,2236.0
ACA,Arcosa Inc. Common Stock ,Industrials,True,1484.0
ACAB,Atlantic Coastal Acquisition Corp. II Class A Common Stock,Finance,True,644.0
ACAD,ACADIA Pharmaceuticals Inc. Common Stock,Health Care,True,5120.0
ACB,Aurora Cannabis Inc. Common Shares,Health Care,True,2571.0
ACCD,Accolade Inc. Common Stock,Consumer Discretionary,True,1069.0
ACCO,Acco Brands Corporation Common Stock,Consumer Discretionary,True,4812.0
ACDC,ProFrac Holding Corp. Class A Common Stock,Energy,True,598.0
ACEL,Accel Entertainment Inc. ,Consumer Discretionary,True,1786.0
ACET,Adicet Bio Inc. Common Stock ,Health Care,True,1680.0
ACGL,Arch Capital Group Ltd. Common Stock,Finance,True,6225.0
ACGLN,Arch Capital Group Ltd. Depositary Shares each Representing a 1/1000th Interest in a 4.550% Non-Cumulative Preferred Share Series G,Finance,True,837.0
ACGLO,Arch Capital Group Ltd. Depositary Shares Each Representing 1/1000th Interest in a Share of 5.45% Non-Cumulative Preferred Shares Series F,Finance,True,1789.0
ACHC,Acadia Healthcare Company Inc. Common Stock,Health Care,True,6225.0
ACHL,Achilles Therapeutics plc American Depositary Shares,Health Care,True,881.0
ACHR,Archer Aviation Inc. Class A Common Stock,Industrials,True,950.0
ACHV,Achieve Life Sciences Inc. Common Shares,Health Care,True,6225.0
ACI,Albertsons Companies Inc. Class A Common Stock,Consumer Staples,True,1072.0
ACIC,American Coastal Insurance Corporation Common Stock,Finance,True,4252.0
ACIU,AC Immune SA Common Stock,Health Care,True,2017.0
ACIW,ACI Worldwide Inc. Common Stock,Technology,True,6225.0
ACLS,Axcelis Technologies Inc. Common Stock,Technology,True,6094.0
ACLX,Arcellx Inc. Common Stock,Health Care,True,666.0
ACM,AECOM Common Stock,Consumer Discretionary,True,4378.0
ACMR,ACM Research Inc. Class A Common Stock,Technology,True,1737.0
ACN,Accenture plc Class A Ordinary Shares (Ireland),Consumer Discretionary,True,5836.0
ACNB,ACNB Corporation Common Stock,Finance,True,6225.0
ACNT,Ascent Industries Co. Common Stock,Industrials,True,6225.0
ACON,Aclarion Inc. Common Stock,Health Care,True,613.0
ACP,abrdn Income Credit Strategies Fund Common Shares,Finance,True,3441.0
ACR,ACRES Commercial Realty Corp. Common Stock,Real Estate,True,4693.0
ACRE,Ares Commercial Real Estate Corporation Common Stock,Real Estate,True,3126.0
ACRS,Aclaris Therapeutics Inc. Common Stock,Health Care,True,2261.0
ACRV,Acrivon Therapeutics Inc. Common Stock,Health Care,True,470.0
ACST,Acasti Pharma Inc. Class A Common Stock,Health Care,True,3182.0
ACT,Enact Holdings Inc. Common Stock,Finance,True,764.0
ACTU,Actuate Therapeutics Inc. Common stock,Health Care,True,34.0
ACU,Acme United Corporation. Common Stock,Consumer Discretionary,True,6225.0
ACV,Virtus Diversified Income & Convertible Fund Common Shares of Beneficial Interest,Finance,True,2356.0
ACVA,ACV Auctions Inc. Class A Common Stock,Consumer Discretionary,True,886.0
ACXP,Acurx Pharmaceuticals Inc. Common Stock,Health Care,True,821.0
ADAG,Adagene Inc. American Depositary Shares,Health Care,True,916.0
ADAP,Adaptimmune Therapeutics plc American Depositary Shares,Health Care,True,2367.0
ADBE,Adobe Inc. Common Stock,Technology,True,6225.0
ADC,Agree Realty Corporation Common Stock,Real Estate,True,6225.0
ADCT,ADC Therapeutics SA Common Shares,Health Care,True,1100.0
ADD,Color Star Technology Co. Ltd. Class A Ordinary Shares,Consumer Discretionary,True,3997.0
ADEA,Adeia Inc. Common Stock,Technology,True,5254.0
ADGM,Adagio Medical Holdings Inc Common Stock,Health Care,True,41.0
ADI,Analog Devices Inc. Common Stock,Technology,True,6225.0
ADIL,Adial Pharmaceuticals Inc Common Stock,Health Care,True,1554.0
ADM,Archer-Daniels-Midland Company Common Stock,Consumer Staples,True,6225.0
ADMA,ADMA Biologics Inc Common Stock,Health Care,True,2756.0
ADNT,Adient plc Ordinary Shares ,Consumer Discretionary,True,2001.0
ADP,Automatic Data Processing Inc. Common Stock,Technology,True,6225.0
ADPT,Adaptive Biotechnologies Corporation Common Stock,Health Care,True,1324.0
ADRT,Ault Disruptive Technologies Corporation Common Stock,Finance,True,663.0
ADSE,ADS-TEC ENERGY PLC Ordinary Shares,Consumer Discretionary,True,896.0
ADSK,Autodesk Inc. Common Stock,Technology,True,6225.0
ADT,ADT Inc. Common Stock,Consumer Discretionary,True,1685.0
ADTN,ADTRAN Holdings Inc. Common Stock,Utilities,True,6225.0
ADTX,Aditxt Inc. Common Stock,Health Care,True,1070.0
ADUS,Addus HomeCare Corporation Common Stock,Health Care,True,3755.0
ADV,Advantage Solutions Inc. Class A Common Stock,Consumer Discretionary,True,1194.0
ADVM,Adverum Biotechnologies Inc. Common Stock,Health Care,True,2559.0
ADX,Adams Diversified Equity Fund Inc.,Finance,True,6225.0
ADXN,Addex Therapeutics Ltd American Depositary Shares,Health Care,True,1166.0
AE,Adams Resources & Energy Inc. Common Stock,Energy,True,6225.0
AEE,Ameren Corporation Common Stock,Utilities,True,6225.0
AEF,abrdn Emerging Markets Equity Income Fund Inc. Common Stock,Finance,True,6225.0
AEG,Aegon Ltd. New York Registry Shares,Finance,True,6225.0
AEHL,Antelope Enterprise Holdings Limited Class A Ordinary Shares,Industrials,True,4225.0
AEHR,Aehr Test Systems Common Stock,Industrials,True,6225.0
AEI,Alset Inc. Common Stock (TX),Finance,True,966.0
AEIS,Advanced Energy Industries Inc. Common Stock,Technology,True,6225.0
AEM,Agnico Eagle Mines Limited Common Stock,Basic Materials,True,6225.0
AEMD,Aethlon Medical Inc. Common Stock,Health Care,True,6225.0
AENT,Alliance Entertainment Holding Corporation Class A Common Stock,Consumer Discretionary,True,886.0
AEO,American Eagle Outfitters Inc. Common Stock,Consumer Discretionary,True,6225.0
AEON,AEON Biopharma Inc. Class A Common Stock,Health Care,True,300.0
AEP,American Electric Power Company Inc. Common Stock,Utilities,True,6225.0
AER,AerCap Holdings N.V. Ordinary Shares,Consumer Discretionary,True,4493.0
AERT,Aeries Technology Inc. Class A Ordinary Share,Consumer Discretionary,True,699.0
AES,The AES Corporation Common Stock,Utilities,True,6225.0
AESI,Atlas Energy Solutions Inc. Common Stock,Industrials,True,393.0
AEVA,Aeva Technologies Inc. Common Stock,Consumer Discretionary,True,1156.0
AEYE,AudioEye Inc. Common Stock,Technology,True,2877.0
AFB,AllianceBernstein National Municipal Income Fund Inc,Finance,True,5707.0
AFBI,Affinity Bancshares Inc. Common Stock (MD),Finance,True,1868.0
AFCG,AFC Gamma Inc. Common Stock,Finance,True,889.0
AFG,American Financial Group Inc. Common Stock,Finance,True,6225.0
AFGB,American Financial Group Inc. 5.875% Subordinated Debentures due 2059,Finance,True,1132.0
AFGC,American Financial Group Inc. 5.125% Subordinated Debentures due 2059,Finance,True,1182.0
AFGD,American Financial Group Inc. 5.625% Subordinated Debentures due 2060,Finance,True,1088.0
AFGE,American Financial Group Inc. 4.500% Subordinated Debentures due 2060,Finance,True,1014.0
AFL,AFLAC Incorporated Common Stock,Finance,True,6225.0
AFMD,Affimed N.V.,Health Care,True,2529.0
AFRI,Forafric Global PLC Ordinary Shares,Consumer Staples,True,918.0
AFRM,Affirm Holdings Inc. Class A Common Stock,Finance,True,934.0
AFYA,Afya Limited Class A Common Shares,Real Estate,True,1309.0
AG,First Majestic Silver Corp. Ordinary Shares (Canada),Basic Materials,True,4489.0
AGAE,Allied Gaming & Entertainment Inc. Common Stock,Consumer Discretionary,True,1743.0
AGBA,AGBA Group Holding Limited Ordinary Share,Finance,True,470.0
AGCO,AGCO Corporation Common Stock,Industrials,True,6225.0
AGD,abrdn Global Dynamic Dividend Fund Common Shares of Beneficial Interest,Finance,True,4575.0
AGEN,Agenus Inc. Common Stock,Health Care,True,6200.0
AGFY,Agrify Corporation Common Stock,Consumer Staples,True,924.0
AGI,Alamos Gold Inc. Class A Common Shares,Basic Materials,True,5390.0
AGIO,Agios Pharmaceuticals Inc. Common Stock,Health Care,True,2816.0
AGL,agilon health inc. Common Stock,Health Care,True,871.0
AGM,Federal Agricultural Mortgage Corporation Common Stock,Finance,True,6225.0
AGMH,AGM Group Holdings Inc. Class A Ordinary Shares,Technology,True,1624.0
AGNC,AGNC Investment Corp. Common Stock,Real Estate,True,4122.0
AGNCL,AGNC Investment Corp. Depositary Shares Each Representing a 1/1000th Interest in a Share of 7.75% Series G Fixed-Rate Reset Cumulative Redeemable Preferred Stock,Real Estate,True,517.0
AGNCM,AGNC Investment Corp. Depositary Shares rep 6.875% Series D Fixed-to-Floating Cumulative Redeemable Preferred Stock,Real Estate,True,1403.0
AGNCN,AGNC Investment Corp. Depositary Shares Each Representing a 1/1000th Interest in a Share of 7.00% Series C Fixed-To-Floating Rate Cumulative Redeemable Preferred Stock,Real Estate,True,1792.0
AGNCO,AGNC Investment Corp. Depositary Shares each representing a 1/1000th interest in a share of 6.50% Series E Fixed-to-Floating Cumulative Redeemable Preferred Stock,Real Estate,True,1260.0
AGNCP,AGNC Investment Corp. Depositary Shares Each Representing a 1/1000th Interest in a Share of 6.125% Series F Fixed-to-Floating Rate Cumulative Redeemable Preferred Stock,Real Estate,True,1171.0
AGO,Assured Guaranty Ltd. Common Stock,Finance,True,5144.0
AGR,Avangrid Inc. Common Stock,Utilities,True,2210.0
AGRI,AgriFORCE  Growing Systems Ltd. Common Shares,Industrials,True,813.0
AGRO,Adecoagro S.A. Common Shares,Consumer Staples,True,3440.0
AGS,PlayAGS Inc. Common Stock,Consumer Discretionary,True,1680.0
AGX,Argan Inc. Common Stock,Consumer Discretionary,True,6225.0
AGYS,Agilysys Inc. Common Stock (DE),Technology,True,6225.0
AHCO,AdaptHealth Corp. Common Stock,Health Care,True,1594.0
AHG,Akso Health Group ADS,Consumer Discretionary,True,1736.0
AHH,Armada Hoffler Properties Inc. Common Stock,Finance,True,2869.0
AHR,American Healthcare REIT Inc. Common Stock,Real Estate,True,163.0
AHT,Ashford Hospitality Trust Inc Common Stock,Real Estate,True,5310.0
AI,C3.ai Inc. Class A Common Stock,Technology,True,957.0
AIEV,Thunder Power Holdings Inc. Common Stock,Consumer Discretionary,True,540.0
AIFF,Firefly Neuroscience Inc. Common Stock,Technology,True,6225.0
AIG,American International Group Inc. New Common Stock,Finance,True,6225.0
AIHS,Senmiao Technology Limited Common Stock,Finance,True,1645.0
AILE,iLearningEngines Inc. Common Stock,Technology,True,864.0
AIM,AIM ImmunoTech Inc. Common Stock,Health Care,True,6225.0
AIMAU,Aimfinity Investment Corp. I Unit,Finance,True,611.0
AIMBU,Aimfinity Investment Corp. I Subunit,Finance,True,285.0
AIMD,Ainos Inc. Common Stock,Health Care,True,937.0
AIN,Albany International Corporation Common Stock,Consumer Discretionary,True,6225.0
AIO,Virtus Artificial Intelligence & Technology Opportunities Fund Common Shares of Beneficial Interest,Finance,True,1238.0
AIOT,PowerFleet Inc. Common Stock,Telecommunications,True,6225.0
AIP,Arteris Inc. Common Stock,Technology,True,735.0
AIR,AAR Corp. Common Stock,Industrials,True,6225.0
AIRE,reAlpha Tech Corp. Common Stock,Finance,True,236.0
AIRG,Airgain Inc. Common Stock,Technology,True,2046.0
AIRI,Air Industries Group Common Stock,Industrials,True,6033.0
AIRJ,Montana Technologies Corporation Class A Common Stock,Industrials,True,669.0
AIRS,AirSculpt Technologies Inc. Common Stock,Health Care,True,733.0
AIRT,Air T Inc. Common Stock,Consumer Discretionary,True,6225.0
AIRTP,Air T Inc. Air T Funding Alpha Income Trust Preferred Securities,Consumer Discretionary,True,1334.0
AISP,Airship AI Holdings Inc. Class A Common Stock,Technology,True,854.0
AIT,Applied Industrial Technologies Inc. Common Stock,Consumer Discretionary,True,6225.0
AIV,Apartment Investment and Management Company Common Stock,Real Estate,True,6225.0
AIXI,XIAO-I Corporation American Depositary Shares,Technology,True,393.0
AIZ,Assurant Inc. Common Stock,Finance,True,5198.0
AIZN,Assurant Inc. 5.25% Subordinated Notes due 2061,Finance,True,966.0
AJG,Arthur J. Gallagher & Co. Common Stock,Finance,True,6225.0
AJX,Great Ajax Corp. Common Stock,Real Estate,True,2423.0
AKA,a.k.a. Brands Holding Corp. Common Stock,Consumer Discretionary,True,760.0
AKAM,Akamai Technologies Inc. Common Stock,Consumer Discretionary,True,6225.0
AKAN,Akanda Corp. Common Shares,Health Care,True,640.0
AKBA,Akebia Therapeutics Inc. Common Stock,Health Care,True,2651.0
AKR,Acadia Realty Trust Common Stock,Real Estate,True,6225.0
AKRO,Akero Therapeutics Inc. Common Stock,Health Care,True,1329.0
AKTS,Akoustis Technologies Inc. Common Stock,Utilities,True,2347.0
AKTX,Akari Therapeutics plc ADS,Health Care,True,2702.0
AKYA,Akoya BioSciences Inc. Common Stock,Industrials,True,870.0
AL,Air Lease Corporation Class A Common Stock,Consumer Discretionary,True,3384.0
ALAB,Astera Labs Inc. Common Stock,Technology,True,134.0
ALAR,Alarum Technologies Ltd. American Depositary Share,Technology,True,1539.0
ALB,Albemarle Corporation Common Stock,Industrials,True,6225.0
ALBT,Avalon GloboCare Corp. Common Stock,Health Care,True,1639.0
ALC,Alcon Inc. Ordinary Shares,Health Care,True,1379.0
ALCE,Alternus Clean Energy Inc. Class A Common Stock,Utilities,True,615.0
ALCY,Alchemy Investments Acquisition Corp 1 Class A Ordinary Shares,Finance,True,311.0
ALDX,Aldeyra Therapeutics Inc. Common Stock,Health Care,True,2621.0
ALE,Allete Inc.,Utilities,True,6225.0
ALEC,Alector Inc. Common Stock,Health Care,True,1421.0
ALEX,Alexander & Baldwin Inc. Common Stock REIT Holding Company,Real Estate,True,3093.0
ALG,Alamo Group Inc. Common Stock,Industrials,True,6225.0
ALGM,Allegro MicroSystems Inc. Common Stock,Technology,True,985.0
ALGN,Align Technology Inc. Common Stock,Health Care,True,5954.0
ALGS,Aligos Therapeutics Inc. Common Stock,Health Care,True,994.0
ALGT,Allegiant Travel Company Common Stock,Consumer Discretionary,True,4481.0
ALHC,Alignment Healthcare Inc. Common Stock,Health Care,True,884.0
ALIT,Alight Inc. Class A Common Stock,Consumer Discretionary,True,1058.0
ALK,Alaska Air Group Inc. Common Stock,Consumer Discretionary,True,6225.0
ALKS,Alkermes plc Ordinary Shares,Health Care,True,6225.0
ALKT,Alkami Technology Inc. Common Stock,Technology,True,872.0
ALL,Allstate Corporation (The) Common Stock,Finance,True,6225.0
ALLE,Allegion plc Ordinary Shares,Consumer Discretionary,True,2734.0
ALLK,Allakos Inc. Common Stock,Health Care,True,1560.0
ALLO,Allogene Therapeutics Inc. Common Stock,Health Care,True,1501.0
ALLR,Allarity Therapeutics Inc. Common Stock,Health Care,True,697.0
ALLT,Allot Ltd. Ordinary Shares,Telecommunications,True,4496.0
ALLY,Ally Financial Inc. Common Stock,Finance,True,2687.0
ALMS,Alumis Inc. Common Stock,Health Care,True,65.0
ALNT,Allient Inc. Common Stock,Industrials,True,6225.0
ALNY,Alnylam Pharmaceuticals Inc. Common Stock,Health Care,True,5118.0
ALOT,AstroNova Inc. Common Stock,Technology,True,6225.0
ALPP,Alpine 4 Holdings Inc. Class A Common Stock,Telecommunications,True,1940.0
ALRM,Alarm.com Holdings Inc. Common Stock,Technology,True,2331.0
ALRN,Aileron Therapeutics Inc. Common Stock,Health Care,True,1825.0
ALRS,Alerus Financial Corporation Common Stock,Finance,True,5420.0
ALSA,Alpha Star Acquisition Corporation Ordinary Shares,Finance,True,677.0
ALSN,Allison Transmission Holdings Inc. Common Stock,Consumer Discretionary,True,3156.0
ALT,Altimmune Inc. Common Stock,Health Care,True,1848.0
ALTG,Alta Equipment Group Inc. Class A Common Stock,Industrials,True,1368.0
ALTI,AlTi Global Inc. Class A Common Stock,Finance,True,863.0
ALTM,Arcadium Lithium plc Ordinary Shares,Industrials,True,1501.0
ALTO,Alto Ingredients Inc. Common Stock,Industrials,True,4913.0
ALTR,Altair Engineering Inc. Class A Common Stock,Technology,True,1738.0
ALTS,ALT5 Sigma Corporation Common Stock,Consumer Discretionary,True,6225.0
ALUR,Allurion Technologies Inc. Common Stock,Health Care,True,883.0
ALV,Autoliv Inc. Common Stock,Consumer Discretionary,True,6225.0
ALVO,Alvotech Ordinary Shares,Health Care,True,575.0
ALVR,AlloVir Inc. Common Stock,Health Care,True,1049.0
ALX,Alexander's Inc. Common Stock,Real Estate,True,6225.0
ALXO,ALX Oncology Holdings Inc. Common Stock,Health Care,True,1058.0
ALZN,Alzamend Neuro Inc. Common Stock,Health Care,True,829.0
AM,Antero Midstream Corporation Common Stock,Utilities,True,1864.0
AMAL,Amalgamated Financial Corp. Common Stock (DE),Finance,True,1545.0
AMAT,Applied Materials Inc. Common Stock,Technology,True,6225.0
AMBA,Ambarella Inc. Ordinary Shares,Technology,True,3011.0
AMBC,Ambac Financial Group Inc. Common Stock,Finance,True,2874.0
AMBI,Ambipar Emergency Response Class A Ordinary Shares,Industrials,True,1019.0
AMBO,Ambow Education Holding Ltd. American Depository Shares (each representing twenty (20) Class A Ordinary Shares),Real Estate,True,1588.0
AMBP,Ardagh Metal Packaging S.A. Ordinary Shares,Industrials,True,793.0
AMC,AMC Entertainment Holdings Inc. Class A Common Stock,Consumer Discretionary,True,2713.0
AMCR,Amcor plc Ordinary Shares,Consumer Discretionary,True,3114.0
AMCX,AMC Networks Inc. Class A Common Stock,Telecommunications,True,3344.0
AMD,Advanced Micro Devices Inc. Common Stock,Technology,True,6225.0
AME,AMETEK Inc.,Industrials,True,6225.0
AMED,Amedisys Inc Common Stock,Health Care,True,6225.0
AMG,Affiliated Managers Group Inc. Common Stock,Finance,True,6225.0
AMGN,Amgen Inc. Common Stock,Health Care,True,6225.0
AMH,American Homes 4 Rent Common Shares of Beneficial Interest,Real Estate,True,2810.0
AMIX,Autonomix Medical Inc. Common Stock,Health Care,True,170.0
AMKR,Amkor Technology Inc. Common Stock,Technology,True,6225.0
AMLI,American Lithium Corp. Common Stock,Basic Materials,True,2155.0
AMLX,Amylyx Pharmaceuticals Inc. Common Stock,Health Care,True,685.0
AMN,AMN Healthcare Services Inc,Consumer Discretionary,True,5758.0
AMP,Ameriprise Financial Inc. Common Stock,Finance,True,4792.0
AMPG,Amplitech Group Inc. Common Stock,Telecommunications,True,937.0
AMPH,Amphastar Pharmaceuticals Inc. Common Stock,Health Care,True,2584.0
AMPL,Amplitude Inc. Class A Common Stock,Technology,True,756.0
AMPS,Altus Power Inc. Class A Common Stock,Utilities,True,922.0
AMPY,Amplify Energy Corp. Common Stock,Energy,True,3131.0
AMR,Alpha Metallurgical Resources Inc. Common Stock,Energy,True,917.0
AMRC,Ameresco Inc. Class A Common Stock,Consumer Discretionary,True,3572.0
AMRK,A-Mark Precious Metals Inc. Common Stock,Industrials,True,2654.0
AMRN,Amarin Corporation plc,Health Care,True,6225.0
AMRX,Amneal Pharmaceuticals Inc. Class A Common Stock,Health Care,True,1611.0
AMS,American Shared Hospital Services Common Stock,Health Care,True,6225.0
AMSC,American Superconductor Corporation Common Stock,Consumer Discretionary,True,6225.0
AMSF,AMERISAFE Inc. Common Stock,Finance,True,4746.0
AMST,Amesite Inc. Common Stock,Technology,True,1009.0
AMT,American Tower Corporation (REIT) Common Stock,Real Estate,True,6225.0
AMTB,Amerant Bancorp Inc. Class A Common Stock,Finance,True,1496.0
AMTD,AMTD IDEA Group American Depositary Shares each representing six (6) Class A Ordinary Shares,Finance,True,1298.0
AMTX,Aemetis Inc. (DE) Common Stock,Industrials,True,4596.0
AMWD,American Woodmark Corporation Common Stock,Basic Materials,True,6225.0
AMWL,American Well Corporation Class A Common Stock,Consumer Discretionary,True,1015.0
AMX,America Movil S.A.B. de C.V. American Depositary Shares (each representing the right to receive twenty (20) Series B Shares,Telecommunications,True,5945.0
AMZN,Amazon.com Inc. Common Stock,Consumer Discretionary,True,6225.0
AN,AutoNation Inc. Common Stock,Consumer Discretionary,True,6225.0
ANAB,AnaptysBio Inc. Common Stock,Health Care,True,1932.0
ANDE,Andersons Inc. (The) Common Stock,Industrials,True,6225.0
ANEB,Anebulo Pharmaceuticals Inc. Common Stock,Health Care,True,855.0
ANET,Arista Networks Inc. Common Stock,Telecommunications,True,2597.0
ANF,Abercrombie & Fitch Company Common Stock,Consumer Discretionary,True,6225.0
ANGH,Anghami Inc. Ordinary Shares,Consumer Discretionary,True,1033.0
ANGI,Angi Inc. Class A Common Stock,Consumer Discretionary,True,3236.0
ANGO,AngioDynamics Inc. Common Stock,Health Care,True,5118.0
ANIK,Anika Therapeutics Inc. Common Stock,Health Care,True,6225.0
ANIP,ANI Pharmaceuticals Inc.,Health Care,True,6139.0
ANIX,Anixa Biosciences Inc. Common Stock,Health Care,True,6225.0
ANL,Adlai Nortye Ltd. American Depositary Shares,Health Care,True,252.0
ANNX,Annexon Inc. Common Stock,Health Care,True,1053.0
ANRO,Alto Neuroscience Inc. Common Stock,Health Care,True,166.0
ANSS,ANSYS Inc. Common Stock,Technology,True,6225.0
ANTE,AirNet Technology Inc. American Depositary Shares,Consumer Discretionary,True,4252.0
ANTX,AN2 Therapeutics Inc. Common Stock,Health Care,True,632.0
ANVS,Annovis Bio Inc. Common Stock,Health Care,True,1176.0
ANY,Sphere 3D Corp. Common Shares,Finance,True,2803.0
AOD,abrdn Total Dynamic Dividend Fund Common Shares of Beneficial Interest,Finance,True,4391.0
AOMN,Angel Oak Mortgage REIT Inc. 9.500% Senior Notes due 2029,Finance,True,42.0
AOMR,Angel Oak Mortgage REIT Inc. Common Stock,Finance,True,827.0
AON,Aon plc Class A Ordinary Shares (Ireland),Finance,True,6225.0
AORT,Artivion Inc. Common Stock,Health Care,True,6225.0
AOS,A.O. Smith Corporation Common Stock,Consumer Discretionary,True,6225.0
AOSL,Alpha and Omega Semiconductor Limited Common Shares,Technology,True,3630.0
AOUT,American Outdoor Brands Inc. Common Stock ,Consumer Discretionary,True,1033.0
AP,Ampco-Pittsburgh Corporation Common Stock,Industrials,True,6225.0
APA,APA Corporation Common Stock,Energy,True,6225.0
APAM,Artisan Partners Asset Management Inc. Class A Common Stock,Finance,True,2912.0
APCX,AppTech Payments Corp. Common Stock,Technology,True,2851.0
APD,Air Products and Chemicals Inc. Common Stock,Industrials,True,6225.0
APDN,Applied DNA Sciences Inc. Common Stock,Consumer Discretionary,True,5340.0
APEI,American Public Education Inc. Common Stock,Real Estate,True,4250.0
APG,APi Group Corporation Common Stock,Consumer Discretionary,True,1113.0
APGE,Apogee Therapeutics Inc. Common Stock,Health Care,True,306.0
APH,Amphenol Corporation Common Stock,Technology,True,6225.0
API,Agora Inc. American Depositary Shares,Technology,True,1072.0
APLD,Applied Digital Corporation Common Stock,Finance,True,619.0
APLE,Apple Hospitality REIT Inc. Common Shares,Real Estate,True,2359.0
APLM,Apollomics Inc. Class A Ordinary Shares,Health Care,True,714.0
APLMW,Apollomics Inc. Warrant,Health Care,True,378.0
APLS,Apellis Pharmaceuticals Inc. Common Stock,Health Care,True,1732.0
APLT,Applied Therapeutics Inc. Common Stock,Health Care,True,1355.0
APM,Aptorum Group Limited Class A Ordinary Shares,Health Care,True,1455.0
APO,Apollo Global Management Inc. (New) Common Stock,Finance,True,3398.0
APOG,Apogee Enterprises Inc. Common Stock,Consumer Discretionary,True,6225.0
APOS,Apollo Global Management Inc. 7.625% Fixed-Rate Resettable Junior Subordinated Notes due 2053,Finance,True,274.0
APP,Applovin Corporation Class A Common Stock,Technology,True,871.0
APPF,AppFolio Inc. Class A Common Stock,Technology,True,2331.0
APPN,Appian Corporation Class A Common Stock,Technology,True,1849.0
APRE,Aprea Therapeutics Inc. Common stock,Health Care,True,1256.0
APT,Alpha Pro Tech Ltd. Common Stock,Health Care,True,6225.0
APTO,Aptose Biosciences Inc. Common Shares,Health Care,True,6225.0
APTV,Aptiv PLC Ordinary Shares,Consumer Discretionary,True,3236.0
APVO,Aptevo Therapeutics Inc. Common Stock,Health Care,True,2063.0
APWC,Asia Pacific Wire & Cable Corporation Ltd. Ordinary Shares (Bermuda),Industrials,True,5340.0
APXI,APx Acquisition Corp. I Class A Ordinary Share,Finance,True,671.0
APYX,Apyx Medical Corporation Common Stock,Health Care,True,1446.0
AQB,AquaBounty Technologies Inc. Common Stock,Consumer Staples,True,1942.0
AQMS,Aqua Metals Inc. Common Stock,Industrials,True,2307.0
