Symbol,Company_Name,Sector,Data_Exising,History_Existing,IPO_Year,Country,Industry
A,Agilent Technologies Inc. Common Stock,Industrials,True,6225.0,1999.0,United States,Biotechnology: Laboratory Analytical Instruments
AA,Alcoa Corporation Common Stock ,Industrials,True,6225.0,2016.0,United States,Aluminum
AAME,Atlantic American Corporation Common Stock,Finance,True,6225.0,,United States,Life Insurance
AAON,AAON Inc. Common Stock,Industrials,True,6225.0,,United States,Industrial Machinery/Components
AAPL,Apple Inc. Common Stock,Technology,True,6225.0,1980.0,United States,Computer Manufacturing
AB,AllianceBernstein Holding L.P.  Units,Finance,True,6225.0,,United States,Investment Managers
ABCB,Ameris Bancorp Common Stock,Finance,True,6225.0,1994.0,United States,Major Banks
ABEO,Abeona Therapeutics Inc. Common Stock,Health Care,True,6225.0,,United States,Biotechnology: Pharmaceutical Preparations
ABEV,Ambev S.A. American Depositary Shares (Each representing 1 Common Share),Consumer Staples,True,6225.0,2013.0,Brazil,Beverages (Production/Distribution)
ABM,ABM Industries Incorporated Common Stock,Finance,True,6225.0,,United States,Diversified Commercial Services
ABT,Abbott Laboratories Common Stock,Health Care,True,6225.0,,United States,Biotechnology: Pharmaceutical Preparations
ACGL,Arch Capital Group Ltd. Common Stock,Finance,True,6225.0,,Bermuda,Property-Casualty Insurers
ACHC,Acadia Healthcare Company Inc. Common Stock,Health Care,True,6225.0,,United States,Medical Specialities
ACHV,Achieve Life Sciences Inc. Common Shares,Health Care,True,6225.0,,United States,Biotechnology: In Vitro & In Vivo Diagnostic Substances
ACIW,ACI Worldwide Inc. Common Stock,Technology,True,6225.0,,United States,Computer Software: Prepackaged Software
ACNB,ACNB Corporation Common Stock,Finance,True,6225.0,,United States,Major Banks
ACNT,Ascent Industries Co. Common Stock,Industrials,True,6225.0,,United States,Steel/Iron Ore
ACU,Acme United Corporation. Common Stock,Consumer Discretionary,True,6225.0,1988.0,United States,Industrial Machinery/Components
ADBE,Adobe Inc. Common Stock,Technology,True,6225.0,1986.0,United States,Computer Software: Prepackaged Software
ADC,Agree Realty Corporation Common Stock,Real Estate,True,6225.0,,United States,Real Estate Investment Trusts
ADI,Analog Devices Inc. Common Stock,Technology,True,6225.0,,United States,Semiconductors
ADM,Archer-Daniels-Midland Company Common Stock,Consumer Staples,True,6225.0,,United States,Packaged Foods
ADP,Automatic Data Processing Inc. Common Stock,Technology,True,6225.0,,United States,EDP Services
ADSK,Autodesk Inc. Common Stock,Technology,True,6225.0,,United States,Computer Software: Prepackaged Software
ADTN,ADTRAN Holdings Inc. Common Stock,Utilities,True,6225.0,1994.0,United States,Telecommunications Equipment
ADX,Adams Diversified Equity Fund Inc.,Finance,True,6225.0,,United States,Investment Managers
AE,Adams Resources & Energy Inc. Common Stock,Energy,True,6225.0,1980.0,United States,Oil Refining/Marketing
AEE,Ameren Corporation Common Stock,Utilities,True,6225.0,,United States,Power Generation
AEF,abrdn Emerging Markets Equity Income Fund Inc. Common Stock,Finance,True,6225.0,,United States,Finance/Investors Services
AEG,Aegon Ltd. New York Registry Shares,Finance,True,6225.0,,Netherlands,Life Insurance
AEHR,Aehr Test Systems Common Stock,Industrials,True,6225.0,1997.0,United States,Electrical Products
AEIS,Advanced Energy Industries Inc. Common Stock,Technology,True,6225.0,1995.0,United States,Industrial Machinery/Components
AEM,Agnico Eagle Mines Limited Common Stock,Basic Materials,True,6225.0,,Canada,Precious Metals
AEMD,Aethlon Medical Inc. Common Stock,Health Care,True,6225.0,,United States,Medical/Dental Instruments
AEO,American Eagle Outfitters Inc. Common Stock,Consumer Discretionary,True,6225.0,,United States,Clothing/Shoe/Accessory Stores
AEP,American Electric Power Company Inc. Common Stock,Utilities,True,6225.0,,United States,Electric Utilities: Central
AES,The AES Corporation Common Stock,Utilities,True,6225.0,,United States,Electric Utilities: Central
AFG,American Financial Group Inc. Common Stock,Finance,True,6225.0,,United States,Property-Casualty Insurers
AFL,AFLAC Incorporated Common Stock,Finance,True,6225.0,,United States,Accident &Health Insurance
AGCO,AGCO Corporation Common Stock,Industrials,True,6225.0,,United States,Industrial Machinery/Components
AGM,Federal Agricultural Mortgage Corporation Common Stock,Finance,True,6225.0,,United States,Finance Companies
AGX,Argan Inc. Common Stock,Consumer Discretionary,True,6225.0,,United States,Engineering & Construction
AGYS,Agilysys Inc. Common Stock (DE),Technology,True,6225.0,,United States,EDP Services
AIFF,Firefly Neuroscience Inc. Common Stock,Technology,True,6225.0,,United States,Computer Software: Prepackaged Software
AIG,American International Group Inc. New Common Stock,Finance,True,6225.0,,United States,Life Insurance
AIM,AIM ImmunoTech Inc. Common Stock,Health Care,True,6225.0,1997.0,United States,Biotechnology: Biological Products (No Diagnostic Substances)
AIN,Albany International Corporation Common Stock,Consumer Discretionary,True,6225.0,,United States,Textiles
AIOT,PowerFleet Inc. Common Stock,Telecommunications,True,6225.0,,United States,Telecommunications Equipment
AIR,AAR Corp. Common Stock,Industrials,True,6225.0,,United States,Aerospace
AIRT,Air T Inc. Common Stock,Consumer Discretionary,True,6225.0,,United States,Air Freight/Delivery Services
AIT,Applied Industrial Technologies Inc. Common Stock,Consumer Discretionary,True,6225.0,,United States,Industrial Specialties
AIV,Apartment Investment and Management Company Common Stock,Real Estate,True,6225.0,1994.0,United States,Real Estate Investment Trusts
AJG,Arthur J. Gallagher & Co. Common Stock,Finance,True,6225.0,,United States,Specialty Insurers
AKAM,Akamai Technologies Inc. Common Stock,Consumer Discretionary,True,6225.0,1999.0,United States,Business Services
AKR,Acadia Realty Trust Common Stock,Real Estate,True,6225.0,,United States,Real Estate Investment Trusts
ALB,Albemarle Corporation Common Stock,Industrials,True,6225.0,,United States,Major Chemicals
ALE,Allete Inc.,Utilities,True,6225.0,,United States,Power Generation
ALG,Alamo Group Inc. Common Stock,Industrials,True,6225.0,,United States,Industrial Machinery/Components
ALK,Alaska Air Group Inc. Common Stock,Consumer Discretionary,True,6225.0,,United States,Air Freight/Delivery Services
ALKS,Alkermes plc Ordinary Shares,Health Care,True,6225.0,1991.0,Ireland,Biotechnology: Pharmaceutical Preparations
ALL,Allstate Corporation (The) Common Stock,Finance,True,6225.0,,United States,Property-Casualty Insurers
ALNT,Allient Inc. Common Stock,Industrials,True,6225.0,,United States,Electrical Products
ALOT,AstroNova Inc. Common Stock,Technology,True,6225.0,1983.0,United States,Computer peripheral equipment
ALTS,ALT5 Sigma Corporation Common Stock,Consumer Discretionary,True,6225.0,,United States,Home Furnishings
ALV,Autoliv Inc. Common Stock,Consumer Discretionary,True,6225.0,,Sweden,Auto Parts:O.E.M.
ALX,Alexander's Inc. Common Stock,Real Estate,True,6225.0,,United States,Real Estate Investment Trusts
AMAT,Applied Materials Inc. Common Stock,Technology,True,6225.0,1972.0,United States,Semiconductors
AMD,Advanced Micro Devices Inc. Common Stock,Technology,True,6225.0,,United States,Semiconductors
AME,AMETEK Inc.,Industrials,True,6225.0,,United States,Industrial Machinery/Components
AMED,Amedisys Inc Common Stock,Health Care,True,6225.0,,United States,Medical/Nursing Services
AMG,Affiliated Managers Group Inc. Common Stock,Finance,True,6225.0,,United States,Investment Managers
AMGN,Amgen Inc. Common Stock,Health Care,True,6225.0,1983.0,United States,Biotechnology: Biological Products (No Diagnostic Substances)
AMKR,Amkor Technology Inc. Common Stock,Technology,True,6225.0,1998.0,United States,Semiconductors
AMRN,Amarin Corporation plc,Health Care,True,6225.0,,Ireland,Biotechnology: Pharmaceutical Preparations
AMS,American Shared Hospital Services Common Stock,Health Care,True,6225.0,1988.0,United States,Medical Specialities
AMSC,American Superconductor Corporation Common Stock,Consumer Discretionary,True,6225.0,1991.0,United States,Metal Fabrications
AMT,American Tower Corporation (REIT) Common Stock,Real Estate,True,6225.0,,United States,Real Estate Investment Trusts
AMWD,American Woodmark Corporation Common Stock,Basic Materials,True,6225.0,1986.0,United States,Forest Products
AMZN,Amazon.com Inc. Common Stock,Consumer Discretionary,True,6225.0,1997.0,United States,Catalog/Specialty Distribution
AN,AutoNation Inc. Common Stock,Consumer Discretionary,True,6225.0,,United States,Retail-Auto Dealers and Gas Stations
ANDE,Andersons Inc. (The) Common Stock,Industrials,True,6225.0,,United States,Farming/Seeds/Milling
ANF,Abercrombie & Fitch Company Common Stock,Consumer Discretionary,True,6225.0,,United States,Clothing/Shoe/Accessory Stores
ANIK,Anika Therapeutics Inc. Common Stock,Health Care,True,6225.0,,United States,Medical/Dental Instruments
ANIX,Anixa Biosciences Inc. Common Stock,Health Care,True,6225.0,,United States,Biotechnology: Pharmaceutical Preparations
ANSS,ANSYS Inc. Common Stock,Technology,True,6225.0,1996.0,United States,Computer Software: Prepackaged Software
AON,Aon plc Class A Ordinary Shares (Ireland),Finance,True,6225.0,,United States,Specialty Insurers
AORT,Artivion Inc. Common Stock,Health Care,True,6225.0,,United States,Medical/Dental Instruments
AOS,A.O. Smith Corporation Common Stock,Consumer Discretionary,True,6225.0,,United States,Consumer Electronics/Appliances
AP,Ampco-Pittsburgh Corporation Common Stock,Industrials,True,6225.0,,United States,Fluid Controls
APA,APA Corporation Common Stock,Energy,True,6225.0,,United States,Oil & Gas Production
APD,Air Products and Chemicals Inc. Common Stock,Industrials,True,6225.0,,United States,Major Chemicals
APH,Amphenol Corporation Common Stock,Technology,True,6225.0,,United States,Electrical Products
APOG,Apogee Enterprises Inc. Common Stock,Consumer Discretionary,True,6225.0,,United States,Auto Parts:O.E.M.
APT,Alpha Pro Tech Ltd. Common Stock,Health Care,True,6225.0,2000.0,Canada,Industrial Specialties
APTO,Aptose Biosciences Inc. Common Shares,Health Care,True,6225.0,,Canada,Biotechnology: Biological Products (No Diagnostic Substances)
ARCB,ArcBest Corporation Common Stock,Industrials,True,6225.0,,United States,Trucking Freight/Courier Services
ARE,Alexandria Real Estate Equities Inc. Common Stock,Real Estate,True,6225.0,,United States,Real Estate Investment Trusts
ARKR,Ark Restaurants Corp. Common Stock,Consumer Discretionary,True,6225.0,,United States,Restaurants
ARL,American Realty Investors Inc. Common Stock,Real Estate,True,6225.0,,United States,Other Consumer Services
ARLP,Alliance Resource Partners L.P. Common Units representing Limited Partners Interests,Energy,True,6225.0,1999.0,United States,Coal Mining
ARMP,Armata Pharmaceuticals Inc. Common Stock,Health Care,True,6225.0,,United States,Biotechnology: Biological Products (No Diagnostic Substances)
AROW,Arrow Financial Corporation Common Stock,Finance,True,6225.0,,United States,Major Banks
ARTNA,Artesian Resources Corporation Class A Common Stock,Utilities,True,6225.0,,United States,Water Supply
ARTW,Art's-Way Manufacturing Co. Inc. Common Stock,Industrials,True,6225.0,,United States,Industrial Machinery/Components
ARW,Arrow Electronics Inc. Common Stock,Technology,True,6225.0,,United States,Electronic Components
ARWR,Arrowhead Pharmaceuticals Inc. Common Stock,Health Care,True,6225.0,,United States,Biotechnology: Pharmaceutical Preparations
ASA,ASA  Gold and Precious Metals Limited,Industrials,True,6225.0,,United States,Precious Metals
ASB,Associated Banc-Corp Common Stock,Finance,True,6225.0,,United States,Major Banks
ASG,Liberty All-Star Growth Fund Inc.,Finance,True,6225.0,,United States,Investment Managers
ASGN,ASGN Incorporated Common Stock,Consumer Discretionary,True,6225.0,1992.0,United States,Professional Services
ASH,Ashland Inc. Common Stock,Consumer Discretionary,True,6225.0,,United States,Specialty Chemicals
ASML,ASML Holding N.V. New York Registry Shares,Technology,True,6225.0,1995.0,Netherlands,Industrial Machinery/Components
ASRT,Assertio Holdings Inc. Common Stock,Health Care,True,6225.0,,United States,Biotechnology: Pharmaceutical Preparations
ASRV,AmeriServ Financial Inc. Common Stock,Finance,True,6225.0,,United States,Major Banks
ASTC,Astrotech Corporation (DE) Common Stock,Industrials,True,6225.0,,United States,Biotechnology: Laboratory Analytical Instruments
ASTE,Astec Industries Inc. Common Stock,Industrials,True,6225.0,1986.0,United States,Construction/Ag Equipment/Trucks
ASUR,Asure Software Inc Common Stock,Technology,True,6225.0,,United States,EDP Services
ASYS,Amtech Systems Inc. Common Stock,Technology,True,6225.0,,United States,Industrial Machinery/Components
ATGE,Adtalem Global Education Inc. Common Stock,Real Estate,True,6225.0,,United States,Other Consumer Services
ATI,ATI Inc. Common Stock,Industrials,True,6225.0,,United States,Steel/Iron Ore
ATLC,Atlanticus Holdings Corporation Common Stock,Finance,True,6225.0,1995.0,United States,Finance: Consumer Services
ATNI,ATN International Inc. Common Stock,Telecommunications,True,6225.0,,United States,Telecommunications Equipment
ATO,Atmos Energy Corporation Common Stock,Utilities,True,6225.0,,United States,Oil/Gas Transmission
ATR,AptarGroup Inc. Common Stock,Industrials,True,6225.0,,United States,Plastic Products
ATRO,Astronics Corporation Common Stock,Industrials,True,6225.0,,United States,Military/Government/Technical
AU,AngloGold Ashanti PLC Ordinary Shares,Basic Materials,True,6225.0,,South Africa,Precious Metals
AUB,Atlantic Union Bankshares Corporation Common Stock,Finance,True,6225.0,,United States,Major Banks
AUBN,Auburn National Bancorporation Inc. Common Stock,Finance,True,6225.0,,United States,Major Banks
AUDC,AudioCodes Ltd. Common Stock,Utilities,True,6225.0,1999.0,Israel,Telecommunications Equipment
AVA,Avista Corporation Common Stock,Utilities,True,6225.0,,United States,Power Generation
AVB,AvalonBay Communities Inc. Common Stock,Real Estate,True,6225.0,,United States,Real Estate Investment Trusts
AVD,American Vanguard Corporation Common Stock ($0.10 Par Value),Industrials,True,6225.0,1998.0,United States,Agricultural Chemicals
AVDL,Avadel Pharmaceuticals plc Ordinary Share,Health Care,True,6225.0,,France,Biotechnology: Pharmaceutical Preparations
AVNT,Avient Corporation Common Stock,Industrials,True,6225.0,,United States,Major Chemicals
AVNW,Aviat Networks Inc. Common Stock,Technology,True,6225.0,,United States,Radio And Television Broadcasting And Communications Equipment
AVT,Avnet Inc. Common Stock,Technology,True,6225.0,,United States,Electronic Components
AVY,Avery Dennison Corporation Common Stock,Consumer Discretionary,True,6225.0,,United States,Containers/Packaging
AWF,Alliancebernstein Global High Income Fund,Finance,True,6225.0,1993.0,United States,Trusts Except Educational Religious and Charitable
AWR,American States Water Company Common Stock,Utilities,True,6225.0,,United States,Water Supply
AWRE,Aware Inc. Common Stock,Technology,True,6225.0,1996.0,United States,Computer Software: Prepackaged Software
AWX,Avalon Holdings Corporation Common Stock,Utilities,True,6225.0,1998.0,United States,Environmental Services
AXDX,Accelerate Diagnostics Inc. Common Stock,Industrials,True,6225.0,,United States,Biotechnology: Laboratory Analytical Instruments
AXGN,Axogen Inc. Common Stock,Health Care,True,6225.0,,United States,Biotechnology: Electromedical & Electrotherapeutic Apparatus
AXL,American Axle & Manufacturing Holdings Inc. Common Stock,Consumer Discretionary,True,6225.0,,United States,Auto Parts:O.E.M.
AXP,American Express Company Common Stock,Finance,True,6225.0,,United States,Finance: Consumer Services
AXR,AMREP Corporation Common Stock,Real Estate,True,6225.0,,United States,Homebuilding
AXTI,AXT Inc Common Stock,Technology,True,6225.0,1998.0,United States,Semiconductors
AZN,AstraZeneca PLC American Depositary Shares,Health Care,True,6225.0,,United Kingdom,Biotechnology: Pharmaceutical Preparations
AZO,AutoZone Inc. Common Stock,Consumer Discretionary,True,6225.0,,United States,Auto & Home Supply Stores
AZPN,Aspen Technology Inc. Common Stock,Technology,True,6225.0,,United States,EDP Services
AZTA,Azenta Inc.,Technology,True,6225.0,,United States,Industrial Machinery/Components
AZZ,AZZ Inc.,Industrials,True,6225.0,,United States,Industrial Specialties
B,Barnes Group Inc. Common Stock,Industrials,True,6225.0,,United States,Metal Fabrications
BA,Boeing Company (The) Common Stock,Industrials,True,6225.0,,United States,Aerospace
BAC,Bank of America Corporation Common Stock,Finance,True,6225.0,,United States,Major Banks
BAK,Braskem SA ADR,Industrials,True,6225.0,,Brazil,Major Chemicals
BALL,Ball Corporation Common Stock,Industrials,True,6225.0,,United States,Containers/Packaging
BANF,BancFirst Corporation Common Stock,Finance,True,6225.0,1993.0,United States,Major Banks
BANR,Banner Corporation Common Stock,Finance,True,6225.0,,United States,Major Banks
BAP,Credicorp Ltd. Common Stock,Finance,True,6225.0,,Peru,Commercial Banks
BAX,Baxter International Inc. Common Stock,Health Care,True,6225.0,,United States,Medical/Dental Instruments
BB,BlackBerry Limited Common Stock,Technology,True,6225.0,,Canada,Computer Software: Prepackaged Software
BBAR,Banco BBVA Argentina S.A. ADS,Finance,True,6225.0,,Argentina,Commercial Banks
BBSI,Barrett Business Services Inc. Common Stock,Consumer Discretionary,True,6225.0,1993.0,United States,Professional Services
BBVA,Banco Bilbao Vizcaya Argentaria S.A. Common Stock,Finance,True,6225.0,,Spain,Commercial Banks
BBWI,Bath & Body Works Inc.,Consumer Discretionary,True,6225.0,,United States,Clothing/Shoe/Accessory Stores
BBY,Best Buy Co. Inc. Common Stock,Consumer Discretionary,True,6225.0,,United States,Consumer Electronics/Video Chains
BC,Brunswick Corporation Common Stock,Industrials,True,6225.0,,United States,Industrial Machinery/Components
BCDA,BioCardia Inc. Common Stock,Health Care,True,6225.0,,United States,Biotechnology: Biological Products (No Diagnostic Substances)
BCE,BCE Inc. Common Stock,Telecommunications,True,6225.0,,Canada,Telecommunications Equipment
BCO,Brinks Company (The) Common Stock,Consumer Discretionary,True,6225.0,,United States,Oil Refining/Marketing
BCPC,Balchem Corporation Common Stock,Industrials,True,6225.0,,United States,Major Chemicals
BCRX,BioCryst Pharmaceuticals Inc. Common Stock,Health Care,True,6225.0,1994.0,United States,Biotechnology: Biological Products (No Diagnostic Substances)
BCS,Barclays PLC Common Stock,Finance,True,6225.0,,United Kingdom,Commercial Banks
BCV,Bancroft Fund Ltd.,Finance,True,6225.0,1972.0,United States,Finance/Investors Services
BDC,Belden Inc Common Stock,Industrials,True,6225.0,,United States,Telecommunications Equipment
BDL,Flanigan's Enterprises Inc. Common Stock,Consumer Discretionary,True,6225.0,1972.0,United States,Restaurants
BDN,Brandywine Realty Trust Common Stock,Real Estate,True,6225.0,,United States,Real Estate Investment Trusts
BDX,Becton Dickinson and Company Common Stock,Health Care,True,6225.0,,United States,Medical/Dental Instruments
BEN,Franklin Resources Inc. Common Stock,Finance,True,6225.0,,United States,Investment Managers
BFS,Saul Centers Inc. Common Stock,Real Estate,True,6225.0,1993.0,United States,Real Estate Investment Trusts
BGC,BGC Group Inc. Class A Common Stock,Finance,True,6225.0,,United States,Investment Bankers/Brokers/Service
BH,Biglari Holdings Inc. Class B Common Stock,Consumer Discretionary,True,6225.0,2018.0,United States,Restaurants
BHB,Bar Harbor Bankshares Inc. Common Stock,Finance,True,6225.0,1997.0,United States,Major Banks
BHC,Bausch Health Companies Inc. Common Stock,Health Care,True,6225.0,,Canada,Biotechnology: Pharmaceutical Preparations
BHE,Benchmark Electronics Inc. Common Stock,Technology,True,6225.0,,United States,Electrical Products
BHP,BHP Group Limited American Depositary Shares (Each representing two Ordinary Shares),Energy,True,6225.0,,Australia,Coal Mining
BIIB,Biogen Inc. Common Stock,Health Care,True,6225.0,,United States,Biotechnology: Biological Products (No Diagnostic Substances)
BIO,Bio-Rad Laboratories Inc. Class A Common Stock,Industrials,True,6225.0,1980.0,United States,Biotechnology: Laboratory Analytical Instruments
BJRI,BJ's Restaurants Inc. Common Stock,Consumer Discretionary,True,6225.0,,United States,Restaurants
BK,The Bank of New York Mellon Corporation Common Stock,Finance,True,6225.0,,United States,Major Banks
BKE,Buckle Inc. (The) Common Stock,Consumer Discretionary,True,6225.0,,United States,Clothing/Shoe/Accessory Stores
BKH,Black Hills Corporation Common Stock,Utilities,True,6225.0,,United States,Electric Utilities: Central
BKN,BlackRock Investment Quality Municipal Trust Inc. (The),Finance,True,6225.0,1993.0,United States,Trusts Except Educational Religious and Charitable
BKNG,Booking Holdings Inc. Common Stock,Consumer Discretionary,True,6225.0,,United States,Transportation Services
BKR,Baker Hughes Company Class A Common Stock,Industrials,True,6225.0,,United States,Metal Fabrications
BKT,BlackRock Income Trust Inc. (The),Finance,True,6225.0,,United States,Investment Bankers/Brokers/Service
BKTI,BK Technologies Corporation Common Stock,Technology,True,6225.0,,United States,Radio And Television Broadcasting And Communications Equipment
BKYI,BIO-key International Inc. Common Stock,Technology,True,6225.0,,United States,Computer Software: Prepackaged Software
BLDP,Ballard Power Systems Inc. Common Shares,Energy,True,6225.0,,Canada,Industrial Machinery/Components
BLFS,BioLife Solutions Inc. Common Stock,Health Care,True,6225.0,,United States,Biotechnology: Electromedical & Electrotherapeutic Apparatus
BLK,BlackRock Inc. Common Stock,Finance,True,6225.0,1999.0,United States,Investment Bankers/Brokers/Service
BLX,Banco Latinoamericano de Comercio Exterior S.A.,Finance,True,6225.0,1992.0,Panama,Commercial Banks
BMI,Badger Meter Inc. Common Stock,Industrials,True,6225.0,1971.0,United States,Industrial Machinery/Components
BMO,Bank Of Montreal Common Stock,Finance,True,6225.0,,Canada,Commercial Banks
BMRA,Biomerica Inc. Common Stock,Health Care,True,6225.0,,United States,Biotechnology: In Vitro & In Vivo Diagnostic Substances
BMRC,Bank of Marin Bancorp Common Stock,Finance,True,6225.0,,United States,Major Banks
BMRN,BioMarin Pharmaceutical Inc. Common Stock,Health Care,True,6225.0,1999.0,United States,Biotechnology: Pharmaceutical Preparations
BMY,Bristol-Myers Squibb Company Common Stock,Health Care,True,6225.0,,United States,Biotechnology: Pharmaceutical Preparations
BN,Brookfield Corporation Class A Limited Voting Shares,Real Estate,True,6225.0,1925.0,Canada,Building operators
BOH,Bank of Hawaii Corporation Common Stock,Finance,True,6225.0,,United States,Major Banks
BOKF,BOK Financial Corporation Common Stock,Finance,True,6225.0,,United States,Major Banks
BOOM,DMC Global Inc. Common Stock,Industrials,True,6225.0,,United States,Industrial Specialties
BOSC,B.O.S. Better Online Solutions Common Stock,Telecommunications,True,6225.0,,Israel,Computer Communications Equipment
BP,BP p.l.c. Common Stock,Energy,True,6225.0,,United Kingdom,Integrated oil Companies
BPOP,Popular Inc. Common Stock,Finance,True,6225.0,,United States,Major Banks
BPT,BP Prudhoe Bay Royalty Trust Common Stock,Energy,True,6225.0,,United States,Integrated oil Companies
BRC,Brady Corporation Common Stock,Consumer Discretionary,True,6225.0,,United States,Miscellaneous manufacturing industries
BRID,Bridgford Foods Corporation Common Stock,Consumer Staples,True,6225.0,,United States,Specialty Foods
BRKL,Brookline Bancorp Inc. Common Stock,Finance,True,6225.0,,United States,Savings Institutions
BRN,Barnwell Industries Inc. Common Stock,Energy,True,6225.0,1965.0,United States,Oil & Gas Production
BRO,Brown & Brown Inc. Common Stock,Finance,True,6225.0,,United States,Specialty Insurers
BRT,BRT Apartments Corp. (MD) Common Stock,Real Estate,True,6225.0,,United States,Real Estate Investment Trusts
BRW,Saba Capital Income & Opportunities Fund SBI,Finance,True,6225.0,,United States,Trusts Except Educational Religious and Charitable
BSAC,Banco Santander - Chile ADS,Finance,True,6225.0,,Chile,Commercial Banks
BSET,Bassett Furniture Industries Incorporated Common Stock,Consumer Discretionary,True,6225.0,,United States,Home Furnishings
BSRR,Sierra Bancorp Common Stock,Finance,True,6225.0,,United States,Major Banks
BSX,Boston Scientific Corporation Common Stock,Health Care,True,6225.0,,United States,Medical/Dental Instruments
BTI,British American Tobacco  Industries p.l.c. Common Stock ADR,Health Care,True,6225.0,1998.0,United Kingdom, Medicinal Chemicals and Botanical Products 
BTO,John Hancock Financial Opportunities Fund Common Stock,Finance,True,6225.0,1994.0,United States,Investment Managers
BUSE,First Busey Corporation Class A Common Stock,Finance,True,6225.0,,United States,Major Banks
BVN,Buenaventura Mining Company Inc.,Basic Materials,True,6225.0,1996.0,Peru,Metal Mining
BWA,BorgWarner Inc. Common Stock,Consumer Discretionary,True,6225.0,,United States,Auto Parts:O.E.M.
BXMT,Blackstone Mortgage Trust Inc. Common Stock,Real Estate,True,6225.0,,United States,Real Estate Investment Trusts
BXP,BXP Inc. Common Stock,Real Estate,True,6225.0,1997.0,United States,Real Estate Investment Trusts
BYD,Boyd Gaming Corporation Common Stock,Consumer Discretionary,True,6225.0,1993.0,United States,Hotels/Resorts
BYFC,Broadway Financial Corporation Class A Common Stock,Finance,True,6225.0,,United States,Savings Institutions
BZH,Beazer Homes USA Inc. Common Stock,Consumer Discretionary,True,6225.0,1994.0,United States,Homebuilding
C,Citigroup Inc. Common Stock,Finance,True,6225.0,,United States,Major Banks
CAC,Camden National Corporation Common Stock,Finance,True,6225.0,,United States,Major Banks
