Symbol,Company_Name,Sector,Data_Exising,History_Existing,IPO_Year,Country,Industry
EBAY,eBay Inc. Common Stock,Consumer Discretionary,True,6225.0,1998.0,United States,Business Services
EBF,Ennis Inc. Common Stock,Consumer Discretionary,True,6225.0,,United States,Office Equipment/Supplies/Services
ECF,Ellsworth Growth and Income Fund Ltd.,Finance,True,6225.0,1986.0,United States,Finance/Investors Services
ECL,Ecolab Inc. Common Stock,Consumer Discretionary,True,6225.0,,United States,Package Goods/Cosmetics
ECPG,Encore Capital Group Inc Common Stock,Finance,True,6225.0,,United States,Finance Companies
ED,Consolidated Edison Inc. Common Stock,Utilities,True,6225.0,,United States,Power Generation
EDAP,EDAP TMS S.A. American Depositary Shares,Health Care,True,6225.0,1997.0,France,Biotechnology: Electromedical & Electrotherapeutic Apparatus
EDUC,Educational Development Corporation Common Stock,Consumer Discretionary,True,6225.0,,United States,Consumer Specialties
EEA,The European Equity Fund Inc. Common Stock,Finance,True,6225.0,,United States,Trusts Except Educational Religious and Charitable
EEFT,Euronet Worldwide Inc. Common Stock,Finance,True,6225.0,1997.0,United States,Investment Bankers/Brokers/Service
EFOI,Energy Focus Inc. Common Stock,Consumer Discretionary,True,6225.0,,United States,Building Products
EFX,Equifax Inc. Common Stock,Finance,True,6225.0,,United States,Finance: Consumer Services
EG,Everest Group Ltd. Common Stock,Finance,True,6225.0,,Bermuda,Property-Casualty Insurers
EGAN,eGain Corporation Common Stock,Technology,True,6225.0,1999.0,United States,Computer Software: Prepackaged Software
EGBN,Eagle Bancorp Inc. Common Stock,Finance,True,6225.0,,United States,Major Banks
EGHT,8x8 Inc Common Stock,Technology,True,6225.0,,United States,EDP Services
EGP,EastGroup Properties Inc. Common Stock,Real Estate,True,6225.0,,United States,Real Estate Investment Trusts
EGY,VAALCO Energy Inc.  Common Stock,Energy,True,6225.0,,United States,Oil & Gas Production
EHC,Encompass Health Corporation Common Stock,Health Care,True,6225.0,,United States,Hospital/Nursing Management
EIX,Edison International Common Stock,Utilities,True,6225.0,,United States,Electric Utilities: Central
EL,Estee Lauder Companies Inc. (The) Common Stock,Consumer Discretionary,True,6225.0,1995.0,United States,Package Goods/Cosmetics
ELA,Envela Corporation Common Stock,Consumer Discretionary,True,6225.0,,United States,Consumer Specialties
ELLO,Ellomay Capital Ltd Ordinary Shares (Israel),Utilities,True,6225.0,,Israel,Electric Utilities: Central
ELME,Elme Communities Common Stock,Real Estate,True,6225.0,2000.0,United States,Real Estate Investment Trusts
ELP,Companhia Paranaense de Energia (COPEL) American Depositary Shares (each representing one Unit consisting one Common Share and four non-voting Class B Preferred Shares),Utilities,True,6225.0,2021.0,Brazil,Electric Utilities: Central
ELS,Equity Lifestyle Properties Inc. Common Stock,Real Estate,True,6225.0,,United States,Real Estate Investment Trusts
ELSE,Electro-Sensors Inc. Common Stock,Industrials,True,6225.0,,United States,Industrial Machinery/Components
ELTK,Eltek Ltd. Ordinary Shares,Technology,True,6225.0,1997.0,Israel,Electrical Products
EME,EMCOR Group Inc. Common Stock,Industrials,True,6225.0,,United States,Engineering & Construction
EMF,Templeton Emerging Markets Fund Common Stock,Finance,True,6225.0,1987.0,United States,Finance/Investors Services
EMKR,EMCORE Corporation Common Stock,Technology,True,6225.0,1997.0,United States,Semiconductors
EML,Eastern Company (The) Common Stock,Consumer Discretionary,True,6225.0,,United States,Industrial Machinery/Components
EMN,Eastman Chemical Company Common Stock,Industrials,True,6225.0,,United States,Major Chemicals
EMR,Emerson Electric Company Common Stock,Technology,True,6225.0,,United States,Consumer Electronics/Appliances
ENB,Enbridge Inc Common Stock,Energy,True,6225.0,,Canada,Natural Gas Distribution
ENG,ENGlobal Corporation Common Stock,Consumer Discretionary,True,6225.0,,United States,Military/Government/Technical
ENSV,Enservco Corporation Common Stock,Energy,True,6225.0,,United States,Oilfield Services/Equipment
ENZ,Enzo Biochem Inc. Common Stock ($0.01 Par Value),Health Care,True,6225.0,1988.0,United States,Medical Specialities
EOG,EOG Resources Inc. Common Stock,Energy,True,6225.0,,United States,Oil & Gas Production
EP,Empire Petroleum Corporation Common Stock,Energy,True,6225.0,2022.0,United States,Oil & Gas Production
EPD,Enterprise Products Partners L.P. Common Stock,Utilities,True,6225.0,,United States,Natural Gas Distribution
EPM,Evolution Petroleum Corporation Inc. Common Stock,Energy,True,6225.0,,United States,Oil & Gas Production
EPR,EPR Properties Common Stock,Real Estate,True,6225.0,1997.0,United States,Real Estate Investment Trusts
EQC,Equity Commonwealth Common Shares of Beneficial Interest,Real Estate,True,6225.0,,United States,Real Estate Investment Trusts
EQR,Equity Residential Common Shares of Beneficial Interest,Real Estate,True,6225.0,,United States,Real Estate Investment Trusts
EQS,Equus Total Return Inc. Common Stock,Finance,True,6225.0,,United States,Finance/Investors Services
EQT,EQT Corporation Common Stock,Energy,True,6225.0,,United States,Oil & Gas Production
ERIC,Ericsson American Depositary Shares,Technology,True,6225.0,,Sweden,Radio And Television Broadcasting And Communications Equipment
ERIE,Erie Indemnity Company Class A Common Stock,Finance,True,6225.0,,United States,Specialty Insurers
ERNA,Eterna Therapeutics Inc. Common Stock,Health Care,True,6225.0,,United States,Biotechnology: Pharmaceutical Preparations
ES,Eversource Energy (D/B/A) Common Stock,Utilities,True,6225.0,,United States,Electric Utilities: Central
ESCA,Escalade Incorporated Common Stock,Consumer Discretionary,True,6225.0,,United States,Recreational Games/Products/Toys
ESE,ESCO Technologies Inc. Common Stock,Telecommunications,True,6225.0,,United States,Telecommunications Equipment
ESGR,Enstar Group Limited Ordinary Shares,Finance,True,6225.0,,Bermuda,Property-Casualty Insurers
ESLT,Elbit Systems Ltd. Ordinary Shares,Industrials,True,6225.0,,Israel,Military/Government/Technical
ESP,Espey Mfg. & Electronics Corp. Common Stock,Technology,True,6225.0,1960.0,United States,Industrial Machinery/Components
ESS,Essex Property Trust Inc. Common Stock,Real Estate,True,6225.0,1994.0,United States,Real Estate Investment Trusts
ETD,Ethan Allen Interiors Inc. Common Stock,Consumer Discretionary,True,6225.0,,United States,Home Furnishings
ETN,Eaton Corporation PLC Ordinary Shares,Technology,True,6225.0,,Ireland,Industrial Machinery/Components
ETR,Entergy Corporation Common Stock,Utilities,True,6225.0,,United States,Electric Utilities: Central
EVF,Eaton Vance Senior Income Trust Common Stock,Finance,True,6225.0,1998.0,United States,Investment Bankers/Brokers/Service
EVI,EVI Industries Inc.  Common Stock,Consumer Discretionary,True,6225.0,1999.0,United States,Other Consumer Services
EVN,Eaton Vance Municipal Income Trust Common Stock,Finance,True,6225.0,1999.0,United States,Investment Managers
EVRG,Evergy Inc. Common Stock,Utilities,True,6225.0,,United States,Power Generation
EWBC,East West Bancorp Inc. Common Stock,Finance,True,6225.0,,United States,Major Banks
EXC,Exelon Corporation Common Stock,Utilities,True,6225.0,,United States,Power Generation
EXP,Eagle Materials Inc Common Stock,Industrials,True,6225.0,,United States,Building Materials
EXPD,Expeditors International of Washington Inc. Common Stock,Consumer Discretionary,True,6225.0,,United States,Oil Refining/Marketing
EXPO,Exponent Inc. Common Stock,Consumer Discretionary,True,6225.0,,United States,Professional Services
EXTR,Extreme Networks Inc. Common Stock,Telecommunications,True,6225.0,1999.0,United States,Computer Communications Equipment
EZPW,EZCORP Inc. Class A Non Voting Common Stock,Consumer Discretionary,True,6225.0,1991.0,United States,Other Specialty Stores
F,Ford Motor Company Common Stock,Consumer Discretionary,True,6225.0,,United States,Auto Manufacturing
FARM,Farmer Brothers Company Common Stock,Consumer Staples,True,6225.0,,United States,Packaged Foods
FARO,FARO Technologies Inc. Common Stock,Industrials,True,6225.0,1997.0,United States,Industrial Machinery/Components
FAST,Fastenal Company Common Stock,Consumer Discretionary,True,6225.0,1987.0,United States,RETAIL: Building Materials
FAX,abrdn Asia-Pacific Income Fund Inc. Common Stock,Finance,True,6225.0,1986.0,United States,Investment Managers
FBNC,First Bancorp Common Stock,Finance,True,6225.0,1987.0,United States,Major Banks
FBP,First BanCorp. New Common Stock,Finance,True,6225.0,,Puerto Rico,Major Banks
FC,Franklin Covey Company Common Stock,Consumer Discretionary,True,6225.0,,United States,Other Consumer Services
FCAP,First Capital Inc. Common Stock,Finance,True,6225.0,,United States,Savings Institutions
FCBC,First Community Bankshares Inc. (VA) Common Stock,Finance,True,6225.0,,United States,Major Banks
FCCO,First Community Corporation Common Stock,Finance,True,6225.0,,United States,Major Banks
FCEL,FuelCell Energy Inc. Common Stock,Energy,True,6225.0,,United States,Industrial Machinery/Components
FCF,First Commonwealth Financial Corporation Common Stock,Finance,True,6225.0,,United States,Major Banks
FCFS,FirstCash Holdings Inc. Common Stock,Consumer Discretionary,True,6225.0,1991.0,United States,Other Specialty Stores
FCN,FTI Consulting Inc. Common Stock,Consumer Discretionary,True,6225.0,1999.0,United States,Professional Services
FCNCA,First Citizens BancShares Inc. Class A Common Stock,Finance,True,6225.0,,United States,Major Banks
FCO,abrdn Global Income Fund Inc. Common Stock,Finance,True,6225.0,1992.0,United States,Investment Managers
FCX,Freeport-McMoRan Inc. Common Stock,Basic Materials,True,6225.0,,United States,Metal Mining
FDBC,Fidelity D & D Bancorp Inc. Common Stock,Finance,True,6225.0,,United States,Major Banks
FDP,Fresh Del Monte Produce Inc. Common Stock,Consumer Staples,True,6225.0,1997.0,Cayman Islands,Farming/Seeds/Milling
FDS,FactSet Research Systems Inc. Common Stock,Technology,True,6225.0,2000.0,United States,Computer Software: Programming Data Processing
FDX,FedEx Corporation Common Stock,Consumer Discretionary,True,6225.0,,United States,Air Freight/Delivery Services
FE,FirstEnergy Corp. Common Stock,Utilities,True,6225.0,,United States,Electric Utilities: Central
FEIM,Frequency Electronics Inc. Common Stock,Industrials,True,6225.0,,United States,Electrical Products
FELE,Franklin Electric Co. Inc. Common Stock,Consumer Discretionary,True,6225.0,,United States,Metal Fabrications
FFBC,First Financial Bancorp. Common Stock,Finance,True,6225.0,,United States,Major Banks
FFIC,Flushing Financial Corporation Common Stock,Finance,True,6225.0,,United States,Major Banks
FFIN,First Financial Bankshares Inc. Common Stock,Finance,True,6225.0,,United States,Major Banks
FFIV,F5 Inc. Common Stock,Telecommunications,True,6225.0,1999.0,United States,Computer Communications Equipment
FHI,Federated Hermes Inc. Common Stock,Finance,True,6225.0,,United States,Investment Managers
FHN,First Horizon Corporation Common Stock,Finance,True,6225.0,,United States,Major Banks
FI,Fiserv Inc. Common Stock,Consumer Discretionary,True,6225.0,,United States,Business Services
FICO,Fair Isaac Corproation Common Stock,Consumer Discretionary,True,6225.0,,United States,Business Services
FISI,Financial Institutions Inc. Common Stock,Finance,True,6225.0,1999.0,United States,Major Banks
FITB,Fifth Third Bancorp Common Stock,Finance,True,6225.0,,United States,Major Banks
FIX,Comfort Systems USA Inc. Common Stock,Industrials,True,6225.0,1997.0,United States,Engineering & Construction
FIZZ,National Beverage Corp. Common Stock,Consumer Staples,True,6225.0,,United States,Beverages (Production/Distribution)
FL,Foot Locker Inc.,Consumer Discretionary,True,6225.0,,United States,Clothing/Shoe/Accessory Stores
FLEX,Flex Ltd. Ordinary Shares,Technology,True,6225.0,1994.0,Singapore,Electrical Products
FLIC,First of Long Island Corporation (The) Common Stock,Finance,True,6225.0,,United States,Major Banks
FLL,Full House Resorts Inc. Common Stock,Consumer Discretionary,True,6225.0,,United States,Hotels/Resorts
FLO,Flowers Foods Inc. Common Stock,Consumer Staples,True,6225.0,,United States,Packaged Foods
FLS,Flowserve Corporation Common Stock,Industrials,True,6225.0,,United States,Fluid Controls
FLWS,1-800-FLOWERS.COM Inc. Common Stock,Consumer Discretionary,True,6225.0,1999.0,United States,Other Specialty Stores
FLXS,Flexsteel Industries Inc. Common Stock,Consumer Discretionary,True,6225.0,,United States,Home Furnishings
FMBH,First Mid Bancshares Inc. Common Stock,Finance,True,6225.0,,United States,Major Banks
FMC,FMC Corporation Common Stock,Industrials,True,6225.0,,United States,Major Chemicals
FMNB,Farmers National Banc Corp. Common Stock,Finance,True,6225.0,,United States,Major Banks
FMS,Fresenius Medical Care AG American Depositary Shares (Each representing 1/2 of an Ordinary Share),Health Care,True,6225.0,,Germany,Misc Health and Biotechnology Services
FMX,Fomento Economico Mexicano S.A.B. de C.V. Common Stock,Consumer Staples,True,6225.0,,Mexico,Beverages (Production/Distribution)
FNB,F.N.B. Corporation Common Stock,Finance,True,6225.0,,United States,Major Banks
FNLC,First Bancorp Inc  (ME) Common Stock,Finance,True,6225.0,,United States,Major Banks
FNWD,Finward Bancorp Common Stock,Finance,True,6225.0,,United States,Major Banks
FONR,Fonar Corporation Common Stock,Health Care,True,6225.0,1981.0,United States,Biotechnology: Electromedical & Electrotherapeutic Apparatus
FORD,Forward Industries Inc. Common Stock,Industrials,True,6225.0,,United States,Plastic Products
FORR,Forrester Research Inc. Common Stock,Consumer Discretionary,True,6225.0,1996.0,United States,Diversified Commercial Services
FORTY,Formula Systems (1985) Ltd. American Depositary Shares,Technology,True,6225.0,,Israel,EDP Services
FOSL,Fossil Group Inc. Common Stock,Consumer Discretionary,True,6225.0,1993.0,United States,Consumer Specialties
FR,First Industrial Realty Trust Inc. Common Stock,Real Estate,True,6225.0,1994.0,United States,Real Estate Investment Trusts
FRAF,Franklin Financial Services Corporation Common Stock,Finance,True,6225.0,,United States,Major Banks
FRD,Friedman Industries Inc. Common Stock,Industrials,True,6225.0,1975.0,United States,Steel/Iron Ore
FRME,First Merchants Corporation Common Stock,Finance,True,6225.0,,United States,Major Banks
FRPH,FRP Holdings Inc. Common Stock,Finance,True,6225.0,,United States,Real Estate
FRT,Federal Realty Investment Trust Common Stock,Real Estate,True,6225.0,,United States,Real Estate Investment Trusts
FSI,Flexible Solutions International Inc. Common Stock (CDA),Industrials,True,6225.0,2002.0,Canada,Major Chemicals
FSS,Federal Signal Corporation Common Stock,Consumer Discretionary,True,6225.0,,United States,Auto Manufacturing
FSTR,L.B. Foster Company Common Stock,Industrials,True,6225.0,,United States,Metal Fabrications
FT,Franklin Universal Trust Common Stock,Finance,True,6225.0,,United States,Trusts Except Educational Religious and Charitable
FTEK,Fuel Tech Inc. Common Stock,Industrials,True,6225.0,,United States,Pollution Control Equipment
FUL,H. B. Fuller Company Common Stock,Industrials,True,6225.0,,United States,Home Furnishings
FULT,Fulton Financial Corporation Common Stock,Finance,True,6225.0,,United States,Major Banks
FUN,Six Flags Entertainment Corporation Common Stock New,Consumer Discretionary,True,6225.0,,United States,Services-Misc. Amusement & Recreation
FUNC,First United Corporation Common Stock,Finance,True,6225.0,,United States,Major Banks
FUND,Sprott Focus Trust Inc. Common Stock,Finance,True,6225.0,,United States,Investment Managers
FUSB,First US Bancshares Inc. Common Stock,Finance,True,6225.0,,United States,Major Banks
FWRD,Forward Air Corporation Common Stock,Consumer Discretionary,True,6225.0,,United States,Oil Refining/Marketing
FXNC,First National Corporation Common Stock,Finance,True,6225.0,,United States,Major Banks
GAB,Gabelli Equity Trust Inc. (The) Common Stock,Finance,True,6225.0,1986.0,United States,Investment Managers
GABC,German American Bancorp Inc. Common Stock,Finance,True,6225.0,,United States,Major Banks
GAIA,Gaia Inc. Class A Common Stock,Consumer Discretionary,True,6225.0,1999.0,United States,Movies/Entertainment
GAM,General American Investors Inc. Common Stock,Finance,True,6225.0,,United States,Investment Managers
GAP,Gap Inc. (The) Common Stock,Consumer Discretionary,True,6225.0,,United States,Clothing/Shoe/Accessory Stores
GATX,GATX Corporation Common Stock,Consumer Discretionary,True,6225.0,,United States,Transportation Services
GBCI,Glacier Bancorp Inc. Common Stock,Finance,True,6225.0,,United States,Major Banks
GBR,New Concept Energy Inc Common Stock,Energy,True,6225.0,1993.0,United States,Oil & Gas Production
GBX,Greenbrier Companies Inc. (The) Common Stock,Industrials,True,6225.0,1994.0,United States,Railroads
GCBC,Greene County Bancorp Inc. Common Stock,Finance,True,6225.0,,United States,Banks
GCO,Genesco Inc. Common Stock,Consumer Discretionary,True,6225.0,,United States,Clothing/Shoe/Accessory Stores
GCV,Gabelli Convertible and Income Securities Fund Inc. (The) Common Stock,Finance,True,6225.0,,United States,Finance/Investors Services
GD,General Dynamics Corporation Common Stock,Industrials,True,6225.0,,United States,Marine Transportation
GDEN,Golden Entertainment Inc. Common Stock,Consumer Discretionary,True,6225.0,,United States,Services-Misc. Amusement & Recreation
GE,GE Aerospace Common Stock,Technology,True,6225.0,,United States,Consumer Electronics/Appliances
GEG,Great Elm Group Inc. Common Stock,Technology,True,6225.0,,United States,Computer Software: Prepackaged Software
GEL,Genesis Energy L.P. Common Units,Energy,True,6225.0,2001.0,United States,Oil Refining/Marketing
GEN,Gen Digital Inc. Common Stock,Technology,True,6225.0,,United States,Computer Software: Prepackaged Software
GEO,Geo Group Inc (The) REIT,Consumer Discretionary,True,6225.0,,United States,Homebuilding
GEOS,Geospace Technologies Corporation Common Stock (Texas),Industrials,True,6225.0,,United States,Industrial Machinery/Components
GERN,Geron Corporation Common Stock,Health Care,True,6225.0,1996.0,United States,Biotechnology: Pharmaceutical Preparations
GES,Guess? Inc. Common Stock,Consumer Discretionary,True,6225.0,1996.0,United States,Apparel
GF,New Germany Fund Inc. (The) Common Stock,Finance,True,6225.0,1990.0,United States,Investment Managers
GFF,Griffon Corporation Common Stock,Industrials,True,6225.0,,United States,Building Products
GFI,Gold Fields Limited American Depositary Shares,Basic Materials,True,6225.0,,South Africa,Precious Metals
GGB,Gerdau S.A. Common Stock,Industrials,True,6225.0,,Brazil,Steel/Iron Ore
GGG,Graco Inc. Common Stock,Industrials,True,6225.0,,United States,Fluid Controls
GGT,Gabelli Multi-Media Trust Inc. (The) Common Stock,Finance,True,6225.0,,United States,Trusts Except Educational Religious and Charitable
GHC,Graham Holdings Company Common Stock,Real Estate,True,6225.0,,United States,Other Consumer Services
GHI,Greystone Housing Impact Investors LP Beneficial Unit Certificates representing assignments of limited partnership interests,Finance,True,6225.0,2022.0,United States,Finance: Consumer Services
GHM,Graham Corporation Common Stock,Industrials,True,6225.0,1978.0,United States,Industrial Machinery/Components
GIB,CGI Inc. Common Stock,Consumer Discretionary,True,6225.0,,Canada,Professional Services
GIC,Global Industrial Company Common Stock,Industrials,True,6225.0,,United States,Industrial Machinery/Components
GIFI,Gulf Island Fabrication Inc. Common Stock,Industrials,True,6225.0,1997.0,United States,Metal Fabrications
GIII,G-III Apparel Group LTD. Common Stock,Consumer Discretionary,True,6225.0,1989.0,United States,Apparel
GIL,Gildan Activewear Inc. Class A Sub. Vot. Common Stock,Consumer Discretionary,True,6225.0,2000.0,Canada,Apparel
GILD,Gilead Sciences Inc. Common Stock,Health Care,True,6225.0,1992.0,United States,Biotechnology: Biological Products (No Diagnostic Substances)
GILT,Gilat Satellite Networks Ltd. Ordinary Shares,Technology,True,6225.0,,Israel,Radio And Television Broadcasting And Communications Equipment
GIS,General Mills Inc. Common Stock,Consumer Staples,True,6225.0,,United States,Packaged Foods
GL,Globe Life Inc. Common Stock,Finance,True,6225.0,,United States,Life Insurance
GLBZ,Glen Burnie Bancorp Common Stock,Finance,True,6225.0,,United States,Major Banks
GLT,Glatfelter Corporation Common Stock,Basic Materials,True,6225.0,2000.0,United States,Paper
GLW,Corning Incorporated Common Stock,Industrials,True,6225.0,,United States,Telecommunications Equipment
GNSS,Genasys Inc. Common Stock,Consumer Staples,True,6225.0,,United States,Consumer Electronics/Appliances
GNTX,Gentex Corporation Common Stock,Consumer Discretionary,True,6225.0,,United States,Auto Parts:O.E.M.
GOGL,Golden Ocean Group Limited Common Stock,Consumer Discretionary,True,6225.0,,Bermuda,Marine Transportation
GOLD,Barrick Gold Corporation Common Stock (BC),Basic Materials,True,6225.0,,Canada,Precious Metals
GPC,Genuine Parts Company Common Stock,Consumer Discretionary,True,6225.0,,United States,Automotive Aftermarket
GPI,Group 1 Automotive Inc. Common Stock,Consumer Discretionary,True,6225.0,1997.0,United States,Retail-Auto Dealers and Gas Stations
GPK,Graphic Packaging Holding Company,Consumer Discretionary,True,6225.0,,United States,Containers/Packaging
GPUS,Hyperscale Data Inc. Common Stock,Technology,True,6225.0,1997.0,United States,Industrial Machinery/Components
GRC,Gorman-Rupp Company (The) Common Stock,Industrials,True,6225.0,1971.0,United States,Fluid Controls
GROW,U.S. Global Investors Inc. Class A Common Stock,Finance,True,6225.0,,United States,Investment Managers
GS,Goldman Sachs Group Inc. (The) Common Stock,Finance,True,6225.0,1999.0,United States,Investment Bankers/Brokers/Service
GSBC,Great Southern Bancorp Inc. Common Stock,Finance,True,6225.0,1989.0,United States,Major Banks
GSK,GSK plc American Depositary Shares (Each representing two Ordinary Shares),Health Care,True,6225.0,2022.0,United Kingdom,Biotechnology: Pharmaceutical Preparations
GT,The Goodyear Tire & Rubber Company Common Stock,Consumer Discretionary,True,6225.0,,United States,Automotive Aftermarket
GTIM,Good Times Restaurants Inc. Common Stock,Consumer Discretionary,True,6225.0,,United States,Restaurants
GTY,Getty Realty Corporation Common Stock,Finance,True,6225.0,,United States,Real Estate
GUT,Gabelli Utility Trust (The) Common Stock,Finance,True,6225.0,,United States,Trusts Except Educational Religious and Charitable
GVA,Granite Construction Incorporated Common Stock,Industrials,True,6225.0,,United States,Military/Government/Technical
GVP,GSE Systems Inc. Common Stock,Technology,True,6225.0,,United States,Computer Software: Prepackaged Software
GWW,W.W. Grainger Inc. Common Stock,Industrials,True,6225.0,,United States,Office Equipment/Supplies/Services
GYRO,Gyrodyne LLC Common Stock,Real Estate,True,6225.0,,United States,Building operators
HAE,Haemonetics Corporation Common Stock,Health Care,True,6225.0,1991.0,United States,Medical/Dental Instruments
HAFC,Hanmi Financial Corporation Common Stock,Finance,True,6225.0,,United States,Major Banks
HAIN,Hain Celestial Group Inc. (The) Common Stock,Consumer Staples,True,6225.0,,United States,Packaged Foods
HAL,Halliburton Company Common Stock,Energy,True,6225.0,,United States,Oilfield Services/Equipment
HAS,Hasbro Inc. Common Stock,Consumer Discretionary,True,6225.0,,United States,Recreational Games/Products/Toys
HBAN,Huntington Bancshares Incorporated Common Stock,Finance,True,6225.0,,United States,Major Banks
HCKT,Hackett Group Inc (The). Common Stock,Consumer Discretionary,True,6225.0,,United States,Professional Services
HCSG,Healthcare Services Group Inc. Common Stock,Health Care,True,6225.0,1983.0,United States,Hospital/Nursing Management
HD,Home Depot Inc. (The) Common Stock,Consumer Discretionary,True,6225.0,,United States,RETAIL: Building Materials
HDSN,Hudson Technologies Inc. Common Stock,Consumer Discretionary,True,6225.0,,United States,Industrial Specialties
HE,Hawaiian Electric Industries Inc. Common Stock,Utilities,True,6225.0,,United States,Electric Utilities: Central
HEI,Heico Corporation Common Stock,Industrials,True,6225.0,2000.0,United States,Aerospace
HELE,Helen of Troy Limited Common Stock,Consumer Discretionary,True,6225.0,,Bermuda,Home Furnishings
HES,Hess Corporation Common Stock,Energy,True,6225.0,,United States,Integrated oil Companies
HFWA,Heritage Financial Corporation Common Stock,Finance,True,6225.0,,United States,Banks
HGBL,Heritage Global Inc. Common Stock,Consumer Discretionary,True,6225.0,,United States,Business Services
HHS,Harte Hanks Inc. Common Stock,Consumer Discretionary,True,6225.0,,United States,Advertising
HIFS,Hingham Institution for Savings Common Stock,Finance,True,6225.0,,United States,Banks
HIG,Hartford Financial Services Group Inc. (The) Common Stock,Finance,True,6225.0,,United States,Property-Casualty Insurers
HIHO,Highway Holdings Limited Common Stock,Industrials,True,6225.0,,Hong Kong,Metal Fabrications
HIO,Western Asset High Income Opportunity Fund Inc. Common Stock,Finance,True,6225.0,,United States,Finance/Investors Services
HIW,Highwoods Properties Inc. Common Stock,Real Estate,True,6225.0,1994.0,United States,Real Estate Investment Trusts
HIX,Western Asset High Income Fund II Inc. Common Stock,Finance,True,6225.0,1998.0,United States,Finance/Investors Services
HL,Hecla Mining Company Common Stock,Industrials,True,6225.0,,United States,Mining & Quarrying of Nonmetallic Minerals (No Fuels)
HLIO,Helios Technologies Inc. Common Stock,Industrials,True,6225.0,2021.0,United States,Metal Fabrications
HLIT,Harmonic Inc. Common Stock,Technology,True,6225.0,1995.0,United States,Radio And Television Broadcasting And Communications Equipment
