Symbol,Company_Name,Sector,Data_Exising,History_Existing
BIOX,Bioceres Crop Solutions Corp. Ordinary Shares,Industrials,True,1642.0
BIP,Brookfield Infrastructure Partners LP Limited Partnership Units,Consumer Discretionary,True,4209.0
BIPC,Brookfield Infrastructure Corporation ,Consumer Discretionary,True,1133.0
BIPH,Brookfield Infrastructure Corporation 5.000% Subordinated Notes due 2081,Utilities,True,842.0
BIPI,BIP Bermuda Holdings I Limited 5.125% Perpetual Subordinated Notes,Consumer Discretionary,True,673.0
BIPJ,Brookfield Infrastructure Corporation 7.250% Subordinated Notes due 2084,Utilities,True,85.0
BIRD,Allbirds Inc. Class A Common Stock,Consumer Discretionary,True,730.0
BIRK,Birkenstock Holding plc Ordinary Shares,Consumer Discretionary,True,244.0
BIT,BlackRock Multi-Sector Income Trust Common Shares of Beneficial Interest,Finance,True,2919.0
BITF,Bitfarms Ltd. Common Stock,Finance,True,1289.0
BIVI,BioVie Inc. Class A Common Stock,Health Care,True,1014.0
BJ,BJ's Wholesale Club Holdings Inc. Common Stock,Consumer Discretionary,True,1574.0
BJDX,Bluejay Diagnostics Inc. Common Stock,Health Care,True,725.0
BJRI,BJ's Restaurants Inc. Common Stock,Consumer Discretionary,True,6225.0
BK,The Bank of New York Mellon Corporation Common Stock,Finance,True,6225.0
BKD,Brookdale Senior Living Inc. Common Stock,Health Care,True,4744.0
BKE,Buckle Inc. (The) Common Stock,Consumer Discretionary,True,6225.0
BKH,Black Hills Corporation Common Stock,Utilities,True,6225.0
BKKT,Bakkt Holdings Inc. Class A Common Stock,Finance,True,970.0
BKN,BlackRock Investment Quality Municipal Trust Inc. (The),Finance,True,6225.0
BKNG,Booking Holdings Inc. Common Stock,Consumer Discretionary,True,6225.0
BKR,Baker Hughes Company Class A Common Stock,Industrials,True,6225.0
BKSY,BlackSky Technology Inc. Class A Common Stock,Technology,True,1201.0
BKT,BlackRock Income Trust Inc. (The),Finance,True,6225.0
BKTI,BK Technologies Corporation Common Stock,Technology,True,6225.0
BKU,BankUnited Inc. Common Stock,Finance,True,3440.0
BKV,BKV Corporation Common Stock,Energy,True,3.0
BKYI,BIO-key International Inc. Common Stock,Technology,True,6225.0
BL,BlackLine Inc. Common Stock,Technology,True,1992.0
BLAC,Bellevue Life Sciences Acquisition Corp. Common Stock,Finance,True,385.0
BLBD,Blue Bird Corporation Common Stock,Consumer Discretionary,True,2651.0
BLBX,Blackboxstocks Inc. Common Stock,Technology,True,2055.0
BLCO,Bausch + Lomb Corporation Common Shares,Health Care,True,603.0
BLD,TopBuild Corp. Common Stock,Consumer Discretionary,True,2338.0
BLDE,Blade Air Mobility Inc. Class A Common Stock,Consumer Discretionary,True,1233.0
BLDP,Ballard Power Systems Inc. Common Shares,Energy,True,6225.0
BLDR,Builders FirstSource Inc. Common Stock,Consumer Discretionary,True,4847.0
BLE,BlackRock Municipal Income Trust II,Finance,True,5581.0
BLEU,bleuacacia ltd Class A Ordinary Shares,Finance,True,684.0
BLFS,BioLife Solutions Inc. Common Stock,Health Care,True,6225.0
BLFY,Blue Foundry Bancorp Common Stock,Finance,True,807.0
BLIN,Bridgeline Digital Inc. Common Stock,Technology,True,4343.0
BLK,BlackRock Inc. Common Stock,Finance,True,6225.0
BLKB,Blackbaud Inc. Common Stock,Technology,True,5081.0
BLMN,Bloomin' Brands Inc. Common Stock,Consumer Discretionary,True,3055.0
BLMZ,BloomZ Inc. Ordinary Shares,Consumer Discretionary,True,48.0
BLND,Blend Labs Inc. Class A Common Stock,Technology,True,807.0
BLNK,Blink Charging Co. Common Stock,Consumer Discretionary,True,3718.0
BLRX,BioLineRx Ltd. American Depositary Shares,Health Care,True,3316.0
BLTE,Belite Bio Inc American Depositary Shares,Health Care,True,608.0
BLUE,bluebird bio Inc. Common Stock,Health Care,True,2840.0
BLW,Blackrock Limited Duration Income Trust,Consumer Discretionary,True,5330.0
BLX,Banco Latinoamericano de Comercio Exterior S.A.,Finance,True,6225.0
BLZE,Backblaze Inc. Class A Common Stock,Technology,True,724.0
BMA,Banco Macro S.A.  ADR (representing Ten Class B Common Shares),Finance,True,4660.0
BMBL,Bumble Inc. Class A Common Stock,Technology,True,914.0
BME,Blackrock Health Sciences Trust,Finance,True,4911.0
BMEA,Biomea Fusion Inc. Common Stock,Health Care,True,870.0
BMEZ,BlackRock Health Sciences Term Trust Common Shares of Beneficial Interest,Finance,True,1176.0
BMI,Badger Meter Inc. Common Stock,Industrials,True,6225.0
BMN,BlackRock 2037 Municipal Target Term Trust Common Shares of Beneficial Interest,Finance,True,483.0
BMO,Bank Of Montreal Common Stock,Finance,True,6225.0
BMR,Beamr Imaging Ltd. Ordinary Share,Technology,True,400.0
BMRA,Biomerica Inc. Common Stock,Health Care,True,6225.0
BMRC,Bank of Marin Bancorp Common Stock,Finance,True,6225.0
BMRN,BioMarin Pharmaceutical Inc. Common Stock,Health Care,True,6225.0
BMTX,BM Technologies Inc. Common Stock,Finance,True,1515.0
BMY,Bristol-Myers Squibb Company Common Stock,Health Care,True,6225.0
BN,Brookfield Corporation Class A Limited Voting Shares,Real Estate,True,6225.0
BNAI,Brand Engagement Network Inc. Common Stock,Technology,True,862.0
BNED,Barnes & Noble Education Inc Common Stock,Consumer Discretionary,True,2313.0
BNGO,Bionano Genomics Inc. Common Stock,Industrials,True,1537.0
BNH,Brookfield Finance Inc. 4.625% Subordinated Notes due October 16 2080,Real Estate,True,991.0
BNIX,Bannix Acquisition Corp. Common Stock,Finance,True,734.0
BNJ,Brookfield Finance Inc. 4.50% Perpetual Subordinated Notes,Real Estate,True,965.0
BNL,Broadstone Net Lease Inc. Common Stock,Real Estate,True,1015.0
BNOX,Bionomics Limited American Depository Shares,Health Care,True,700.0
BNR,Burning Rock Biotech Limited American Depositary Shares,Health Care,True,1082.0
BNRG,Brenmiller Energy Ltd Ordinary Shares,Industrials,True,590.0
BNS,Bank Nova Scotia Halifax Pfd 3 Ordinary Shares,Finance,True,5617.0
BNT,Brookfield Wealth Solutions Ltd. Class A Exchangeable Limited Voting Shares,Finance,True,820.0
BNTC,Benitec Biopharma Inc. Common Stock,Health Care,True,2585.0
BNTX,BioNTech SE American Depositary Share,Health Care,True,1251.0
BNY,BlackRock New York Municipal Income Trust,Finance,True,5830.0
BNZI,Banzai International Inc. Class A Common Stock,Technology,True,913.0
BOC,Boston Omaha Corporation Class A Common Stock,Finance,True,1837.0
BOCN,Blue Ocean Acquisition Corp Class A Ordinary Shares,Finance,True,655.0
BODI,The Beachbody Company Inc. Class A Common Stock,Consumer Discretionary,True,932.0
BOE,Blackrock Enhanced Global Dividend Trust Common Shares of Beneficial Interest,Finance,True,4869.0
BOF,BranchOut Food Inc. Common Stock,Consumer Staples,True,324.0
BOH,Bank of Hawaii Corporation Common Stock,Finance,True,6225.0
BOKF,BOK Financial Corporation Common Stock,Finance,True,6225.0
BOLD,Boundless Bio Inc. Common Stock,Health Care,True,128.0
BOLT,Bolt Biotherapeutics Inc. Common Stock,Health Care,True,918.0
BON,Bon Natural Life Limited Ordinary Shares,Health Care,True,822.0
BOOM,DMC Global Inc. Common Stock,Industrials,True,6225.0
BOOT,Boot Barn Holdings Inc. Common Stock,Consumer Discretionary,True,2495.0
BORR,Borr Drilling Limited Common Shares,Energy,True,1302.0
BOSC,B.O.S. Better Online Solutions Common Stock,Telecommunications,True,6225.0
BOTJ,Bank of the James Financial Group Inc. Common Stock,Finance,True,6072.0
BOW,Bowhead Specialty Holdings Inc. Common Stock,Finance,True,89.0
BOWL,Bowlero Corp. Class A Common Stock,Consumer Discretionary,True,865.0
BOX,Box Inc. Class A Common Stock,Technology,True,2438.0
BOXL,Boxlight Corporation Class A Common Stock,Real Estate,True,1718.0
BP,BP p.l.c. Common Stock,Energy,True,6225.0
BPMC,Blueprint Medicines Corporation Common Stock,Health Care,True,2371.0
BPOP,Popular Inc. Common Stock,Finance,True,6225.0
BPOPM,Popular Inc. Popular Capital Trust II - 6.125% Cumulative Monthly Income Trust Preferred Securities,Finance,True,3991.0
BPRN,Princeton Bancorp Inc. Common Stock (PA),Finance,True,1846.0
BPT,BP Prudhoe Bay Royalty Trust Common Stock,Energy,True,6225.0
BPTH,Bio-Path Holdings Inc. Common Stock,Health Care,True,4173.0
BPYPM,Brookfield Property Partners L.P. 6.25% Class A Cumulative Redeemable Preferred Units Series 1,Finance,True,800.0
BPYPN,Brookfield Property Partners L.P. 5.750% Class A Cumulative Redeemable Perpetual Preferred Units Series 3,Finance,True,1167.0
BPYPO,Brookfield Property Partners L.P. 6.375% Class A Cumulative Redeemable Perpetual Preferred Units Series 2,Finance,True,1286.0
BPYPP,Brookfield Property Partners L.P. 6.50% Class A Cumulative Redeemable Perpetual Preferred Units,Finance,True,1397.0
BQ,Boqii Holding Limited American Depositary Shares representing Class A Ordinary Shares,Consumer Discretionary,True,244.0
BR,Broadridge Financial Solutions Inc. Common Stock,Consumer Discretionary,True,4412.0
BRAC,Broad Capital Acquisition Corp Common Stock,Finance,True,654.0
BRAG,Bragg Gaming Group Inc. Common Shares,Technology,True,1639.0
BRBR,BellRing Brands Inc. Common Stock ,Consumer Staples,True,1245.0
BRBS,Blue Ridge Bankshares Inc. Common Stock,Finance,True,3022.0
BRC,Brady Corporation Common Stock,Consumer Discretionary,True,6225.0
BRCC,BRC Inc. Class A Common Stock,Consumer Staples,True,662.0
BRDG,Bridge Investment Group Holdings Inc. Class A Common Stock,Finance,True,807.0
BREA,Brera Holdings PLC Class B Ordinary Shares,Consumer Discretionary,True,421.0
BRFH,Barfresh Food Group Inc. Common Stock,Consumer Staples,True,3115.0
BRFS,BRF S.A.,Consumer Staples,True,6022.0
BRID,Bridgford Foods Corporation Common Stock,Consumer Staples,True,6225.0
BRKH,BurTech Acquisition Corp. Class A Common Stock,Finance,True,670.0
BRKHU,BurTech Acquisition Corp. Unit,Finance,True,703.0
BRKL,Brookline Bancorp Inc. Common Stock,Finance,True,6225.0
BRKR,Bruker Corporation Common Stock,Industrials,True,6076.0
BRLS,Borealis Foods Inc. Class A Common Shares,Consumer Staples,True,750.0
BRLT,Brilliant Earth Group Inc. Class A Common Stock,Consumer Discretionary,True,759.0
BRN,Barnwell Industries Inc. Common Stock,Energy,True,6225.0
BRNS,Barinthus Biotherapeutics plc American Depositary Shares,Health Care,True,860.0
BRO,Brown & Brown Inc. Common Stock,Finance,True,6225.0
BROG,Brooge Energy Limited Ordinary Shares,Energy,True,1564.0
BROS,Dutch Bros Inc. Class A Common Stock,Consumer Discretionary,True,765.0
BRSP,BrightSpire Capital Inc. Class A Common Stock,Real Estate,True,1676.0
BRT,BRT Apartments Corp. (MD) Common Stock,Real Estate,True,6225.0
BRTX,BioRestorative Therapies Inc. Common Stock (NV),Health Care,True,2974.0
BRW,Saba Capital Income & Opportunities Fund SBI,Finance,True,6225.0
BRX,Brixmor Property Group Inc. Common Stock,Real Estate,True,2747.0
BRY,Berry Corporation (bry) Common Stock,Energy,True,1561.0
BRZE,Braze Inc. Class A Common Stock,Technology,True,720.0
BSAC,Banco Santander - Chile ADS,Finance,True,6225.0
BSBK,Bogota Financial Corp. Common Stock,Finance,True,1184.0
BSBR,Banco Santander Brasil SA American Depositary Shares each representing one unit,Finance,True,3770.0
BSET,Bassett Furniture Industries Incorporated Common Stock,Consumer Discretionary,True,6225.0
BSIG,BrightSphere Investment Group Inc. Common Stock,Finance,True,2510.0
BSIIU,Black Spade Acquisition II Co Unit,Finance,True,23.0
BSL,Blackstone Senior Floating Rate 2027 Term Fund Common Shares of Beneficial Interest,Finance,True,3611.0
BSLK,Bolt Projects Holdings Inc. Common Stock,Industrials,True,855.0
BSM,Black Stone Minerals L.P. Common units representing limited partner interests,Energy,True,2371.0
BSRR,Sierra Bancorp Common Stock,Finance,True,6225.0
BST,BlackRock Science and Technology Trust Common Shares of Beneficial Interest,Finance,True,2496.0
BSTZ,BlackRock Science and Technology Term Trust Common Shares of Beneficial Interest,Finance,True,1325.0
BSVN,Bank7 Corp. Common stock,Finance,True,1516.0
BSX,Boston Scientific Corporation Common Stock,Health Care,True,6225.0
BSY,Bentley Systems Incorporated Class B Common Stock,Technology,True,1011.0
BTA,BlackRock Long-Term Municipal Advantage Trust Common Shares of Beneficial Interest,Finance,True,4680.0
BTAI,BioXcel Therapeutics Inc. Common Stock,Health Care,True,1652.0
BTBD,BT Brands Inc. Common Stock,Consumer Discretionary,True,723.0
BTBT,Bit Digital Inc. Ordinary Shares,Finance,True,1644.0
BTCM,BIT Mining Limited ADS,Technology,True,2730.0
BTCS,BTCS Inc. Common Stock,Finance,True,3491.0
BTCT,BTC Digital Ltd. Ordinary Shares,Real Estate,True,1497.0
BTDR,Bitdeer Technologies Group Class A Ordinary Shares,Finance,True,799.0
BTE,Baytex Energy Corp Common Shares,Energy,True,4655.0
BTG,B2Gold Corp Common shares (Canada),Basic Materials,True,4095.0
BTI,British American Tobacco  Industries p.l.c. Common Stock ADR,Health Care,True,6225.0
BTM,Bitcoin Depot Inc. Class A Common Stock,Finance,True,616.0
BTMD,Biote Corp. Class A Common Stock,Health Care,True,862.0
BTO,John Hancock Financial Opportunities Fund Common Stock,Finance,True,6225.0
BTOC,Armlogi Holding Corp. Common Stock,Consumer Discretionary,True,96.0
BTOG,Bit Origin Limited Ordinary Shares,Finance,True,1290.0
BTSG,BrightSpring Health Services Inc. Common Stock,Health Care,True,171.0
BTSGU,BrightSpring Health Services Inc. Tangible Equity Unit,Health Care,True,171.0
BTT,BlackRock Municipal 2030 Target Term Trust,Finance,True,3039.0
BTTR,Better Choice Company Inc. Common Stock,Consumer Staples,True,3597.0
BTU,Peabody Energy Corporation Common Stock ,Energy,True,1886.0
BTZ,BlackRock Credit Allocation Income Trust,Finance,True,4471.0
BUD,Anheuser-Busch Inbev SA Sponsored ADR (Belgium),Consumer Staples,True,3838.0
BUI,BlackRock Utility Infrastructure & Power Opportunities Trust,Finance,True,3232.0
BUJA,Bukit Jalil Global Acquisition 1 Ltd. Ordinary Shares,Finance,True,270.0
BUJAU,Bukit Jalil Global Acquisition 1 Ltd. Unit,Finance,True,317.0
BUR,Burford Capital Limited Ordinary Shares,Finance,True,993.0
BURL,Burlington Stores Inc. Common Stock,Consumer Discretionary,True,2767.0
BUSE,First Busey Corporation Class A Common Stock,Finance,True,6225.0
BV,BrightView Holdings Inc. Common Stock,Consumer Discretionary,True,1574.0
BVFL,BV Financial Inc. Common Stock,Finance,True,4937.0
BVN,Buenaventura Mining Company Inc.,Basic Materials,True,6225.0
BVS,Bioventus Inc. Class A Common Stock,Health Care,True,914.0
BW,Babcock & Wilcox Enterprises Inc. Common Stock,Industrials,True,2339.0
BWA,BorgWarner Inc. Common Stock,Consumer Discretionary,True,6225.0
BWAY,BrainsWay Ltd. American Depositary Shares,Health Care,True,1373.0
BWB,Bridgewater Bancshares Inc. Common Stock,Finance,True,1648.0
BWBBP,Bridgewater Bancshares Inc. Depositary Shares Each Representing a 1/100th Interest in a Share of 5.875% Non-Cumulative Perpetual Preferred Stock Series A,Finance,True,784.0
BWEN,Broadwind Inc. Common Stock,Telecommunications,True,4752.0
BWFG,Bankwell Financial Group Inc. Common Stock,Finance,True,3648.0
BWG,BrandywineGLOBAL Global Income Opportunities Fund Inc.,Finance,True,3147.0
BWIN,The Baldwin Insurance Group Inc. Class A Common Stock,Finance,True,1241.0
BWLP,BW LPG Limited Common Shares,Consumer Discretionary,True,2687.0
BWMN,Bowman Consulting Group Ltd. Common Stock,Consumer Discretionary,True,855.0
BWMX,Betterware de Mexico S.A.P.I. de C.V. Ordinary Shares,Consumer Discretionary,True,1445.0
BWNB,Babcock & Wilcox Enterprises Inc. 6.50% Senior Notes due 2026,Industrials,True,699.0
BWSN,Babcock & Wilcox Enterprises Inc. 8.125% Senior Notes due 2026,Industrials,True,911.0
BWXT,BWX Technologies Inc. Common Stock,Industrials,True,3565.0
BX,Blackstone Inc. Common Stock,Finance,True,4348.0
BXC,Bluelinx Holdings Inc. Common Stock,Consumer Discretionary,True,4982.0
BXMT,Blackstone Mortgage Trust Inc. Common Stock,Real Estate,True,6225.0
BXMX,Nuveen S&P 500 Buy-Write Income Fund Common Shares of Beneficial Interest,Finance,True,5015.0
BXP,BXP Inc. Common Stock,Real Estate,True,6225.0
BXSL,Blackstone Secured Lending Fund Common Shares of Beneficial Interest,Finance,True,734.0
BY,Byline Bancorp Inc. Common Stock,Finance,True,1824.0
BYD,Boyd Gaming Corporation Common Stock,Consumer Discretionary,True,6225.0
BYFC,Broadway Financial Corporation Class A Common Stock,Finance,True,6225.0
BYM,Blackrock Municipal Income Quality Trust Common Shares of Beneficial Interest,Finance,True,5517.0
BYND,Beyond Meat Inc. Common Stock,Consumer Staples,True,1363.0
BYNO,byNordic Acquisition Corporation Class A Common Stock,Finance,True,625.0
BYON,Beyond Inc. Common Stock,Consumer Discretionary,True,5623.0
BYSI,BeyondSpring Inc. Ordinary Shares,Health Care,True,1903.0
BZ,KANZHUN LIMITED American Depository Shares,Technology,True,831.0
BZFD,BuzzFeed Inc. Class A Common Stock,Consumer Discretionary,True,899.0
BZH,Beazer Homes USA Inc. Common Stock,Consumer Discretionary,True,6225.0
BZUN,Baozun Inc. American Depositary Shares,Consumer Discretionary,True,2357.0
C,Citigroup Inc. Common Stock,Finance,True,6225.0
CAAP,Corporacion America Airports SA Common Shares,Consumer Discretionary,True,1676.0
CAAS,China Automotive Systems Inc. Common Stock,Consumer Discretionary,True,5418.0
CABA,Cabaletta Bio Inc. Common Stock,Health Care,True,1240.0
CABO,Cable One Inc. Common Stock,Telecommunications,True,2342.0
CAC,Camden National Corporation Common Stock,Finance,True,6225.0
CACC,Credit Acceptance Corporation Common Stock,Finance,True,6225.0
CACI,CACI International Inc. Class A Common Stock,Technology,True,6225.0
CADE,Cadence Bank Common Stock,Finance,True,6225.0
CADL,Candel Therapeutics Inc. Common Stock,Health Care,True,800.0
CAF,Morgan Stanley China A Share Fund Inc. Common Stock,Finance,True,4531.0
CAG,ConAgra Brands Inc. Common Stock,Consumer Staples,True,6225.0
CAH,Cardinal Health Inc. Common Stock,Health Care,True,6225.0
CAKE,Cheesecake Factory Incorporated (The) Common Stock,Consumer Discretionary,True,6225.0
CAL,Caleres Inc. Common Stock,Consumer Discretionary,True,6225.0
CALC,CalciMedica Inc. Common Stock,Health Care,True,326.0
CALM,Cal-Maine Foods Inc. Common Stock,Consumer Staples,True,6225.0
CALX,Calix Inc Common Stock,Consumer Discretionary,True,3655.0
CAMT,Camtek Ltd. Ordinary Shares,Technology,True,6081.0
CAN,Canaan Inc. American Depositary Shares,Technology,True,1222.0
CANF,Can-Fite Biopharma Ltd Sponsored ADR (Israel),Health Care,True,2994.0
CANG,Cango Inc. American Depositary Shares  each representing two (2) Class A Ordinary Shares,Technology,True,1555.0
CAPL,CrossAmerica Partners LP Common Units representing limited partner interests,Energy,True,3000.0
CAPR,Capricor Therapeutics Inc. Common Stock,Health Care,True,4438.0
CAPT,Captivision Inc. Ordinary Shares,Finance,True,626.0
CAR,Avis Budget Group Inc. Common Stock,Consumer Discretionary,True,6225.0
CARA,Cara Therapeutics Inc. Common Stock,Health Care,True,2684.0
CARE,Carter Bankshares Inc. Common Stock,Finance,True,4417.0
CARG,CarGurus Inc. Class A Common Stock ,Technology,True,1752.0
CARM,Carisma Therapeutics Inc. Common Stock,Health Care,True,2680.0
CARR,Carrier Global Corporation Common Stock ,Industrials,True,1141.0
CARS,Cars.com Inc. Common Stock ,Technology,True,1845.0
CART,Maplebear Inc. Common Stock,Consumer Discretionary,True,260.0
CARV,Carver Bancorp Inc. Common Stock,Finance,True,6225.0
CASH,Pathward Financial Inc. Common Stock,Finance,True,6225.0
CASI,CASI Pharmaceuticals Inc. Ordinary Shares,Health Care,True,6225.0
CASS,Cass Information Systems Inc Common Stock,Consumer Discretionary,True,6225.0
CASY,Casey's General Stores Inc. Common Stock,Consumer Discretionary,True,6225.0
CAT,Caterpillar Inc. Common Stock,Industrials,True,6225.0
CATO,Cato Corporation (The) Class A Common Stock,Consumer Discretionary,True,6225.0
CATX,Perspective Therapeutics Inc. Common Stock,Health Care,True,4752.0
CATY,Cathay General Bancorp Common Stock,Finance,True,6225.0
CAVA,CAVA Group Inc. Common Stock,Consumer Discretionary,True,324.0
CB,Chubb Limited  Common Stock,Finance,True,6225.0
CBAN,Colony Bankcorp Inc. Common Stock,Finance,True,6225.0
CBFV,CB Financial Services Inc. Common Stock,Finance,True,5281.0
CBL,CBL & Associates Properties Inc. Common Stock,Real Estate,True,731.0
CBNK,Capital Bancorp Inc. Common Stock,Finance,True,1512.0
CBOE,Cboe Global Markets Inc. Common Stock,Finance,True,3598.0
CBRE,CBRE Group Inc Common Stock Class A,Finance,True,5111.0
CBRG,Chain Bridge I Class A Ordinary Shares,Finance,True,688.0
CBRL,Cracker Barrel Old Country Store Inc Common Stock,Consumer Discretionary,True,6225.0
CBSH,Commerce Bancshares Inc. Common Stock,Finance,True,6225.0
CBT,Cabot Corporation Common Stock,Industrials,True,6225.0
CBU,Community Financial System Inc. Common Stock,Finance,True,6225.0
CBUS,Cibus Inc. Class A Common Stock,Industrials,True,1811.0
CBZ,CBIZ Inc. Common Stock,Consumer Discretionary,True,6225.0
CC,Chemours Company (The) Common Stock,Industrials,True,2336.0
CCAP,Crescent Capital BDC Inc. Common stock,Finance,True,1173.0
CCB,Coastal Financial Corporation Common Stock,Finance,True,1560.0
CCBG,Capital City Bank Group Common Stock,Finance,True,6225.0
CCCC,C4 Therapeutics Inc. Common Stock,Health Care,True,1004.0
CCCS,CCC Intelligent Solutions Holdings Inc. Common Stock,Technology,True,1003.0
CCD,Calamos Dynamic Convertible & Income Fund Common Stock,Finance,True,2394.0
CCEC,Capital Clean Energy Carriers Corp. Common Share,Consumer Discretionary,True,4406.0
CCEL,Cryo-Cell International Inc. Common Stock,Health Care,True,6225.0
CCEP,Coca-Cola Europacific Partners plc Ordinary Shares,Consumer Staples,True,6225.0
CCG,Cheche Group Inc. Class A Ordinary Shares,Finance,True,260.0
CCGWW,Cheche Group Inc. Warrant,Finance,True,258.0
CCI,Crown Castle Inc. Common Stock,Real Estate,True,6225.0
CCIF,Carlyle Credit Income Fund Shares of Beneficial Interest,Finance,True,1341.0
CCJ,Cameco Corporation Common Stock,Basic Materials,True,6225.0
CCK,Crown Holdings Inc.,Industrials,True,6225.0
CCL,Carnival Corporation Common Stock,Consumer Discretionary,True,6225.0
CCLD,CareCloud Inc. Common Stock,Technology,True,2565.0
CCLDO,CareCloud Inc. 8.75% Series B Cumulative Redeemable Perpetual Preferred Stock,Technology,True,667.0
CCLDP,CareCloud Inc. 11% Series A Cumulative Redeemable Perpetual Preferred Stock,Technology,True,2240.0
CCM,Concord Medical Services Holdings Limited American Depositary Shares (Each represents thirty (30) Class A ordinary shares),Health Care,True,3724.0
CCNE,CNB Financial Corporation Common Stock,Finance,True,6225.0
CCNEP,CNB Financial Corporation Depositary Shares each representing a 1/40th ownership interest in a share of 7.125% Series A Fixed-Rate Non-Cumulative Perpetual Preferred Stock,Finance,True,1033.0
CCO,Clear Channel Outdoor Holdings Inc. Common Stock,Consumer Discretionary,True,4750.0
CCOI,Cogent Communications Holdings Inc.,Consumer Discretionary,True,5702.0
CCRD,CoreCard Corporation Common Stock,Technology,True,6225.0
CCRN,Cross Country Healthcare Inc. Common Stock $0.0001 Par Value,Consumer Discretionary,True,5771.0
CCS,Century Communities Inc. Common Stock,Consumer Discretionary,True,2589.0
CCSI,Consensus Cloud Solutions Inc. Common Stock,Technology,True,754.0
CCTG,CCSC Technology International Holdings Limited Class A Ordinary Shares,Consumer Discretionary,True,177.0
CCU,Compania Cervecerias Unidas S.A. Common Stock,Consumer Staples,True,6225.0
CCZ,Comcast Holdings ZONES,Telecommunications,True,1182.0
CDAQ,Compass Digital Acquisition Corp. Class A Ordinary Shares,Finance,True,708.0
CDE,Coeur Mining Inc. Common Stock,Basic Materials,True,6225.0
CDIO,Cardio Diagnostics Holdings Inc. Common stock,Health Care,True,680.0
CDLR,Cadeler A/S American Depositary Share (each representing four (4) Ordinary Shares),Consumer Discretionary,True,192.0
CDLX,Cardlytics Inc. Common Stock,Technology,True,1670.0
CDMO,Avid Bioservices Inc. Common Stock,Health Care,True,6225.0
CDNA,CareDx Inc. Common Stock,Health Care,True,2569.0
CDNS,Cadence Design Systems Inc. Common Stock,Technology,True,6225.0
CDP,COPT Defense Properties Common Shares of Beneficial Interest,Real Estate,True,6225.0
CDRE,Cadre Holdings Inc. Common Stock,Health Care,True,729.0
CDRO,Codere Online Luxembourg S.A. Ordinary Shares,Consumer Discretionary,True,925.0
CDT,Conduit Pharmaceuticals Inc. Common Stock,Health Care,True,631.0
CDTG,CDT Environmental Technology Investment Holdings Limited ordinary shares,Industrials,True,113.0
CDTX,Cidara Therapeutics Inc. Common Stock,Health Care,True,2382.0
CDW,CDW Corporation Common Stock,Consumer Discretionary,True,2834.0
CDXC,ChromaDex Corporation Common Stock,Health Care,True,4094.0
CDXS,Codexis Inc. Common Stock,Industrials,True,3635.0
CDZI,CADIZ Inc. Common Stock,Utilities,True,6225.0
CDZIP,Cadiz Inc. Depositary Shares,Utilities,True,818.0
CE,Celanese Corporation Common Stock,Industrials,True,4956.0
CEAD,CEA Industries Inc. Common Stock,Industrials,True,2654.0
CECO,CECO Environmental Corp. Common Stock,Industrials,True,6225.0
CEE,The Central and Eastern Europe Fund Inc. (The) Common Stock,Finance,True,6225.0
CEG,Constellation Energy Corporation Common Stock ,Utilities,True,678.0
CEIX,CONSOL Energy Inc. Common Stock ,Energy,True,1729.0
CELC,Celcuity Inc. Common Stock,Health Care,True,1768.0
CELH,Celsius Holdings Inc. Common Stock,Consumer Staples,True,4454.0
CELU,Celularity Inc. Class A Common Stock,Health Care,True,1295.0
CELZ,Creative Medical Technology Holdings Inc. Common Stock,Finance,True,2238.0
CENN,Cenntro Inc. Common Stock,Consumer Discretionary,True,3022.0
CENT,Central Garden & Pet Company Common Stock,Consumer Discretionary,True,6225.0
CENTA,Central Garden & Pet Company Class A Common Stock Nonvoting,Consumer Discretionary,True,4443.0
CENX,Century Aluminum Company Common Stock,Industrials,True,6225.0
CEP,Cantor Equity Partners Inc. Class A Ordinary Shares,Finance,True,34.0
CEPU,Central Puerto S.A. American Depositary Shares (each represents ten Common Shares),Utilities,True,1675.0
CERO,CERo Therapeutics Holdings Inc. Common Stock,Health Care,True,712.0
CERS,Cerus Corporation Common Stock,Technology,True,6225.0
CERT,Certara Inc. Common Stock,Technology,True,955.0
CET,Central Securities Corporation Common Stock,Finance,True,6225.0
CETX,Cemtrex Inc. Common Stock,Technology,True,6225.0
