Symbol,Company_Name,Sector,Data_Exising,History_Existing,IPO_Year,Country,Industry
HLX,Helix Energy Solutions Group Inc. Common Stock,Energy,True,6225.0,,United States,Oilfield Services/Equipment
HMC,Honda Motor Company Ltd. Common Stock,Consumer Discretionary,True,6225.0,,Japan,Auto Manufacturing
HMN,Horace Mann Educators Corporation Common Stock,Finance,True,6225.0,1991.0,United States,Property-Casualty Insurers
HMNF,HMN Financial Inc. Common Stock,Finance,True,6225.0,,United States,Savings Institutions
HMY,Harmony Gold Mining Company Limited,Basic Materials,True,6225.0,,South Africa,Precious Metals
HNI,HNI Corporation Common Stock,Consumer Discretionary,True,6225.0,,United States,Office Equipment/Supplies/Services
HNRG,Hallador Energy Company Common Stock,Energy,True,6225.0,,United States,Coal Mining
HOG,Harley-Davidson Inc. Common Stock,Consumer Discretionary,True,6225.0,,United States,Motor Vehicles
HOLX,Hologic Inc. Common Stock,Health Care,True,6225.0,1990.0,United States,Medical Electronics
HON,Honeywell International Inc. Common Stock,Industrials,True,6225.0,,United States,Aerospace
HOPE,Hope Bancorp Inc. Common Stock,Finance,True,6225.0,,United States,Major Banks
HOV,Hovnanian Enterprises Inc. Class A Common Stock,Consumer Discretionary,True,6225.0,1983.0,United States,Homebuilding
HP,Helmerich & Payne Inc. Common Stock,Energy,True,6225.0,,United States,Oil & Gas Production
HPQ,HP Inc. Common Stock,Technology,True,6225.0,,United States,Computer Manufacturing
HQH,abrdn Healthcare Investors Shares of Beneficial Interest,Finance,True,6225.0,1987.0,United States,Finance Companies
HQL,abrdn Life Sciences Investors Shares of Beneficial Interest,Finance,True,6225.0,1992.0,United States,Investment Managers
HR,Healthcare Realty Trust Incorporated Common Stock,Real Estate,True,6225.0,,United States,Real Estate Investment Trusts
HRB,H&R Block Inc. Common Stock,Consumer Discretionary,True,6225.0,,United States,Other Consumer Services
HRL,Hormel Foods Corporation Common Stock,Consumer Staples,True,6225.0,,United States,Meat/Poultry/Fish
HRTX,Heron Therapeutics Inc. Common Stock,Health Care,True,6225.0,,United States,Biotechnology: Pharmaceutical Preparations
HSBC,HSBC Holdings plc. Common Stock,Finance,True,6225.0,,United Kingdom,Savings Institutions
HSIC,Henry Schein Inc. Common Stock,Health Care,True,6225.0,1995.0,United States,Medical Specialities
HSII,Heidrick & Struggles International Inc. Common Stock,Consumer Discretionary,True,6225.0,1999.0,United States,Diversified Commercial Services
HST,Host Hotels & Resorts Inc. Common Stock,Real Estate,True,6225.0,,United States,Real Estate Investment Trusts
HSY,The Hershey Company Common Stock,Consumer Staples,True,6225.0,,United States,Specialty Foods
HTBK,Heritage Commerce Corp Common Stock,Finance,True,6225.0,,United States,Major Banks
HTLD,Heartland Express Inc. Common Stock,Industrials,True,6225.0,1986.0,United States,Trucking Freight/Courier Services
HTLF,Heartland Financial USA Inc. Common Stock,Finance,True,6225.0,,United States,Major Banks
HUBB,Hubbell Inc Common Stock,Technology,True,6225.0,2015.0,United States,Electrical Products
HUBG,Hub Group Inc. Class A Common Stock,Consumer Discretionary,True,6225.0,1996.0,United States,Oil Refining/Marketing
HUM,Humana Inc. Common Stock,Health Care,True,6225.0,,United States,Medical Specialities
HURC,Hurco Companies Inc. Common Stock,Industrials,True,6225.0,,United States,Industrial Machinery/Components
HVT,Haverty Furniture Companies Inc. Common Stock,Consumer Discretionary,True,6225.0,,United States,Other Specialty Stores
HWBK,Hawthorn Bancshares Inc. Common Stock,Finance,True,6225.0,,United States,Major Banks
HWC,Hancock Whitney Corporation Common Stock,Finance,True,6225.0,,United States,Major Banks
HWKN,Hawkins Inc. Common Stock,Consumer Discretionary,True,6225.0,,United States,Specialty Chemicals
HXL,Hexcel Corporation Common Stock,Industrials,True,6225.0,,United States,Major Chemicals
HYB,New America High Income Fund Inc. (The) Common Stock,Finance,True,6225.0,1988.0,United States,Investment Managers
HZO,MarineMax Inc.  (FL) Common Stock,Consumer Discretionary,True,6225.0,1998.0,United States,Auto & Home Supply Stores
IAC,IAC Inc. Common Stock,Technology,True,6225.0,,United States,Computer Software: Programming Data Processing
IAF,abrdn Australia Equity Fund Inc. Common Stock,Finance,True,6225.0,1985.0,United States,Finance/Investors Services
IART,Integra LifeSciences Holdings Corporation Common Stock,Health Care,True,6225.0,,United States,Medical/Dental Instruments
IBCP,Independent Bank Corporation Common Stock,Finance,True,6225.0,,United States,Major Banks
IBM,International Business Machines Corporation Common Stock,Technology,True,6225.0,,United States,Computer Manufacturing
IBOC,International Bancshares Corporation Common Stock,Finance,True,6225.0,,United States,Major Banks
ICAD,iCAD Inc. Common Stock,Health Care,True,6225.0,,United States,Medical/Dental Instruments
ICCC,ImmuCell Corporation Common Stock,Health Care,True,6225.0,1987.0,United States,Biotechnology: In Vitro & In Vivo Diagnostic Substances
ICLR,ICON plc Ordinary Shares,Health Care,True,6225.0,1998.0,Ireland,Biotechnology: Commercial Physical & Biological Resarch
ICUI,ICU Medical Inc. Common Stock,Health Care,True,6225.0,1992.0,United States,Medical/Dental Instruments
IDA,IDACORP Inc. Common Stock,Utilities,True,6225.0,,United States,Electric Utilities: Central
IDN,Intellicheck Inc. Common Stock,Technology,True,6225.0,1999.0,United States,Computer Software: Prepackaged Software
IDR,Idaho Strategic Resources Inc. Common Stock,Basic Materials,True,6225.0,2022.0,,Precious Metals
IDXX,IDEXX Laboratories Inc. Common Stock,Health Care,True,6225.0,1991.0,United States,Biotechnology: In Vitro & In Vivo Diagnostic Substances
IEP,Icahn Enterprises L.P. Common Stock,Consumer Discretionary,True,6225.0,,United States,Auto Parts:O.E.M.
IESC,IES Holdings Inc. Common Stock,Industrials,True,6225.0,,United States,Engineering & Construction
IEX,IDEX Corporation Common Stock,Industrials,True,6225.0,1989.0,United States,Fluid Controls
IFF,International Flavors & Fragrances Inc. Common Stock,Industrials,True,6225.0,,United States,Major Chemicals
IFN,India Fund Inc. (The) Common Stock,Finance,True,6225.0,,United States,Finance/Investors Services
IGT,International Game Technology Ordinary Shares,Consumer Discretionary,True,6225.0,2015.0,United States,Services-Misc. Amusement & Recreation
IHT,InnSuites Hospitality Trust Shares of Beneficial Interest,Finance,True,6225.0,1999.0,United States,Investment Bankers/Brokers/Service
IIF,Morgan Stanley India Investment Fund Inc. Common Stock,Finance,True,6225.0,1994.0,United States,Trusts Except Educational Religious and Charitable
IIIN,Insteel Industries Inc. Common Stock,Industrials,True,6225.0,,United States,Steel/Iron Ore
IIM,Invesco Value Municipal Income Trust Common Stock,Finance,True,6225.0,,United States,Investment Managers
IMAX,Imax Corporation Common Stock,Consumer Discretionary,True,6225.0,,Canada,Industrial Machinery/Components
IMKTA,Ingles Markets Incorporated Class A Common Stock,Consumer Staples,True,6225.0,1987.0,United States,Food Chains
IMMR,Immersion Corporation Common Stock,Technology,True,6225.0,1999.0,United States,Computer peripheral equipment
IMNN,Imunon Inc. Common Stock,Health Care,True,6225.0,,United States,Biotechnology: Pharmaceutical Preparations
IMO,Imperial Oil Limited Common Stock,Energy,True,6225.0,1929.0,Canada,Integrated oil Companies
INCY,Incyte Corp. Common Stock,Health Care,True,6225.0,,United States,Biotechnology: Commercial Physical & Biological Resarch
INDB,Independent Bank Corp. Common Stock,Finance,True,6225.0,,United States,Major Banks
INFY,Infosys Limited American Depositary Shares,Technology,True,6225.0,,India,EDP Services
ING,ING Group N.V. Common Stock,Finance,True,6225.0,1997.0,Netherlands,Commercial Banks
INGR,Ingredion Incorporated Common Stock,Consumer Staples,True,6225.0,,United States,Packaged Foods
INO,Inovio Pharmaceuticals Inc. Common Stock,Health Care,True,6225.0,,United States,Medical/Dental Instruments
INOD,Innodata Inc. Common Stock,Technology,True,6225.0,1993.0,United States,EDP Services
INSI,Insight Select Income Fund,Finance,True,6225.0,,United States,Investment Managers
INTC,Intel Corporation Common Stock,Technology,True,6225.0,,United States,Semiconductors
INTG,Intergroup Corporation (The) Common Stock,Real Estate,True,6225.0,,United States,Building operators
INTT,inTest Corporation Common Stock,Industrials,True,6225.0,1997.0,United States,Electrical Products
INTU,Intuit Inc. Common Stock,Technology,True,6225.0,1993.0,United States,Computer Software: Prepackaged Software
INTZ,Intrusion Inc. Common Stock,Telecommunications,True,6225.0,,United States,Computer Communications Equipment
INUV,Inuvo Inc.,Consumer Discretionary,True,6225.0,,United States,Advertising
INVE,Identiv Inc. Common Stock,Technology,True,6225.0,,United States,Computer peripheral equipment
INVX,Innovex International Inc. Common Stock,Industrials,True,6225.0,,United States,Metal Fabrications
IONS,Ionis Pharmaceuticals Inc. Common Stock,Health Care,True,6225.0,,United States,Biotechnology: Pharmaceutical Preparations
IOR,Income Opportunity Realty Investors Inc. Common Stock,Real Estate,True,6225.0,1987.0,United States,Real Estate Investment Trusts
IOSP,Innospec Inc. Common Stock,Industrials,True,6225.0,,United States,Major Chemicals
IP,International Paper Company Common Stock,Basic Materials,True,6225.0,,United States,Paper
IPAR,Inter Parfums Inc. Common Stock,Consumer Discretionary,True,6225.0,,United States,Package Goods/Cosmetics
IPG,Interpublic Group of Companies Inc. (The) Common Stock,Consumer Discretionary,True,6225.0,,United States,Advertising
IQI,Invesco Quality Municipal Income Trust Common Stock,Finance,True,6225.0,,United States,Finance Companies
IRIX,IRIDEX Corporation Common Stock,Health Care,True,6225.0,1996.0,United States,Biotechnology: Electromedical & Electrotherapeutic Apparatus
IRM,Iron Mountain Incorporated (Delaware)Common Stock REIT,Real Estate,True,6225.0,,United States,Real Estate Investment Trusts
IRS,IRSA Inversiones Y Representaciones S.A. Global Depositary Shares (Each representing ten shares of Common Stock),Real Estate,True,6225.0,,Argentina,Homebuilding
IT,Gartner Inc. Common Stock,Consumer Discretionary,True,6225.0,1993.0,United States,Other Consumer Services
ITI,Iteris Inc. Common Stock,Telecommunications,True,6225.0,,United States,Telecommunications Equipment
ITIC,Investors Title Company Common Stock,Finance,True,6225.0,,United States,Specialty Insurers
ITRI,Itron Inc. Common Stock,Industrials,True,6225.0,1993.0,United States,Electrical Products
ITT,ITT Inc. Common Stock ,Industrials,True,6225.0,2011.0,United States,Fluid Controls
ITW,Illinois Tool Works Inc. Common Stock,Industrials,True,6225.0,,United States,Industrial Machinery/Components
IVAC,Intevac Inc. Common Stock,Technology,True,6225.0,1995.0,United States,Industrial Machinery/Components
IVZ,Invesco Ltd Common Stock,Finance,True,6225.0,,United States,Investment Managers
IX,Orix Corp Ads Common Stock,Finance,True,6225.0,,Japan,Diversified Financial Services
J,Jacobs Solutions Inc. Common Stock,Industrials,True,6225.0,2022.0,United States,Military/Government/Technical
JACK,Jack In The Box Inc. Common Stock,Consumer Discretionary,True,6225.0,,United States,Restaurants
JAKK,JAKKS Pacific Inc. Common Stock,Consumer Discretionary,True,6225.0,1996.0,United States,Recreational Games/Products/Toys
JBHT,J.B. Hunt Transport Services Inc. Common Stock,Industrials,True,6225.0,,United States,Trucking Freight/Courier Services
JBL,Jabil Inc. Common Stock,Technology,True,6225.0,1993.0,United States,Electrical Products
JBSS,John B. Sanfilippo & Son Inc. Common Stock,Consumer Staples,True,6225.0,1991.0,United States,Specialty Foods
JCI,Johnson Controls International plc Ordinary Share,Industrials,True,6225.0,,Switzerland,Industrial Machinery/Components
JCTCF,Jewett-Cameron Trading Company Common Shares,Consumer Discretionary,True,6225.0,,United States,RETAIL: Building Materials
JEF,Jefferies Financial Group Inc. Common Stock,Finance,True,6225.0,,United States,Investment Bankers/Brokers/Service
JEQ,abrdn Japan Equity Fund Inc. Common Stock,Consumer Discretionary,True,6225.0,1992.0,United States,Air Freight/Delivery Services
JHI,John Hancock Investors Trust Common Stock,Finance,True,6225.0,,United States,Trusts Except Educational Religious and Charitable
JHS,John Hancock Income Securities Trust Common Stock,Finance,True,6225.0,,United States,Finance Companies
JJSF,J & J Snack Foods Corp. Common Stock,Consumer Staples,True,6225.0,1986.0,United States,Specialty Foods
JKHY,Jack Henry & Associates Inc. Common Stock,Technology,True,6225.0,1985.0,United States,EDP Services
JLL,Jones Lang LaSalle Incorporated Common Stock,Finance,True,6225.0,,United States,Real Estate
JMM,Nuveen Multi-Market Income Fund (MA),Finance,True,6225.0,,United States,Trusts Except Educational Religious and Charitable
JNJ,Johnson & Johnson Common Stock,Health Care,True,6225.0,,United States,Biotechnology: Pharmaceutical Preparations
JNPR,Juniper Networks Inc. Common Stock,Telecommunications,True,6225.0,1999.0,United States,Computer Communications Equipment
JOB,GEE Group Inc. Common Stock,Consumer Discretionary,True,6225.0,1968.0,United States,Diversified Commercial Services
JOE,St. Joe Company (The) Common Stock,Real Estate,True,6225.0,,United States,Homebuilding
JOF,Japan Smaller Capitalization Fund Inc Common Stock,Finance,True,6225.0,1990.0,United States,Trusts Except Educational Religious and Charitable
JOUT,Johnson Outdoors Inc. Class A Common Stock,Consumer Discretionary,True,6225.0,,United States,Recreational Games/Products/Toys
JPM,JP Morgan Chase & Co. Common Stock,Finance,True,6225.0,,United States,Major Banks
JWN,Nordstrom Inc. Common Stock,Consumer Discretionary,True,6225.0,,United States,Clothing/Shoe/Accessory Stores
K,Kellanova Common Stock,Consumer Staples,True,6225.0,,United States,Packaged Foods
KAI,Kadant Inc Common Stock,Industrials,True,6225.0,1992.0,United States,Industrial Machinery/Components
KBH,KB Home Common Stock,Consumer Discretionary,True,6225.0,1986.0,United States,Homebuilding
KELYA,Kelly Services Inc. Class A Common Stock,Consumer Discretionary,True,6225.0,,United States,Professional Services
KELYB,Kelly Services Inc. Class B Common Stock,Consumer Discretionary,True,6225.0,,United States,Professional Services
KEP,Korea Electric Power Corporation Common Stock,Utilities,True,6225.0,1994.0,South Korea,Electric Utilities: Central
KEQU,Kewaunee Scientific Corporation Common Stock,Industrials,True,6225.0,,United States,Medical Specialities
KEX,Kirby Corporation Common Stock,Consumer Discretionary,True,6225.0,,United States,Marine Transportation
KEY,KeyCorp Common Stock,Finance,True,6225.0,,United States,Major Banks
KF,Korea Fund Inc. (The) New Common Stock,Finance,True,6225.0,,United States,Investment Managers
KFRC,Kforce Inc. Common Stock,Consumer Discretionary,True,6225.0,1995.0,United States,Professional Services
KFY,Korn Ferry Common Stock,Consumer Discretionary,True,6225.0,1999.0,United States,Diversified Commercial Services
KGC,Kinross Gold Corporation Common Stock,Basic Materials,True,6225.0,2001.0,Canada,Precious Metals
KIM,Kimco Realty Corporation (HC) Common Stock,Real Estate,True,6225.0,,United States,Real Estate Investment Trusts
KINS,Kingstone Companies Inc. Common Stock,Finance,True,6225.0,,United States,Property-Casualty Insurers
KLAC,KLA Corporation Common Stock,Technology,True,6225.0,1980.0,United States,Electronic Components
KLIC,Kulicke and Soffa Industries Inc. Common Stock,Technology,True,6225.0,,Singapore,Semiconductors
KMB,Kimberly-Clark Corporation Common Stock,Consumer Discretionary,True,6225.0,,United States,Containers/Packaging
KMPR,Kemper Corporation,Finance,True,6225.0,,United States,Property-Casualty Insurers
KMT,Kennametal Inc. Common Stock,Industrials,True,6225.0,,United States,Industrial Machinery/Components
KMX,CarMax Inc,Consumer Discretionary,True,6225.0,,United States,Retail-Auto Dealers and Gas Stations
KNX,Knight-Swift Transportation Holdings Inc.,Industrials,True,6225.0,2017.0,United States,Trucking Freight/Courier Services
KO,Coca-Cola Company (The) Common Stock,Consumer Staples,True,6225.0,,United States,Beverages (Production/Distribution)
KOF,Coca Cola Femsa S.A.B. de C.V.  American Depositary Shares each representing 10 Units (each Unit consists of 3 Series B Shares and 5 Series L Shares),Consumer Staples,True,6225.0,1993.0,Mexico,Beverages (Production/Distribution)
KOPN,Kopin Corporation Common Stock,Technology,True,6225.0,1992.0,United States,Semiconductors
KOSS,Koss Corporation Common Stock,Consumer Staples,True,6225.0,,United States,Consumer Electronics/Appliances
KR,Kroger Company (The) Common Stock,Consumer Staples,True,6225.0,,United States,Food Chains
KRC,Kilroy Realty Corporation Common Stock,Real Estate,True,6225.0,1997.0,United States,Real Estate Investment Trusts
KRMD,KORU Medical Systems Inc. Common Stock (DE),Health Care,True,6225.0,,United States,Medical/Dental Instruments
KSM,DWS Strategic Municipal Income Trust,Finance,True,6225.0,1989.0,United States,Trusts Except Educational Religious and Charitable
KSS,Kohl's Corporation Common Stock,Consumer Discretionary,True,6225.0,1992.0,United States,Department/Specialty Retail Stores
KT,KT Corporation Common Stock,Telecommunications,True,6225.0,,South Korea,Telecommunications Equipment
KTCC,Key Tronic Corporation Common Stock,Technology,True,6225.0,1983.0,United States,Electrical Products
KTF,DWS Municipal Income Trust,Finance,True,6225.0,1988.0,United States,Finance Companies
KTOS,Kratos Defense & Security Solutions Inc. Common Stock,Industrials,True,6225.0,,United States,Military/Government/Technical
KVHI,KVH Industries Inc. Common Stock,Technology,True,6225.0,1996.0,United States,Radio And Television Broadcasting And Communications Equipment
KWR,Quaker Houghton Common Stock,Industrials,True,6225.0,,United States,Major Chemicals
KZIA,Kazia Therapeutics Limited American Depositary Shares,Health Care,True,6225.0,,Australia,Biotechnology: Pharmaceutical Preparations
L,Loews Corporation Common Stock,Finance,True,6225.0,,United States,Property-Casualty Insurers
LAD,Lithia Motors Inc. Common Stock,Consumer Discretionary,True,6225.0,,United States,Retail-Auto Dealers and Gas Stations
LAKE,Lakeland Industries Inc. Common Stock,Health Care,True,6225.0,1986.0,United States,Industrial Specialties
LAMR,Lamar Advertising Company Class A Common Stock,Real Estate,True,6225.0,1996.0,United States,Real Estate Investment Trusts
LANC,Lancaster Colony Corporation Common Stock,Consumer Staples,True,6225.0,,United States,Packaged Foods
LARK,Landmark Bancorp Inc. Common Stock,Finance,True,6225.0,,United States,Major Banks
LCII,LCI Industries,Consumer Discretionary,True,6225.0,1995.0,United States,Auto Parts:O.E.M.
LCNB,LCNB Corporation Common Stock,Finance,True,6225.0,,United States,Major Banks
LCTX,Lineage Cell Therapeutics Inc. Common Stock,Health Care,True,6225.0,,United States,Biotechnology: Biological Products (No Diagnostic Substances)
LCUT,Lifetime Brands Inc. Common Stock,Consumer Discretionary,True,6225.0,1991.0,United States,Industrial Machinery/Components
LECO,Lincoln Electric Holdings Inc. Common Shares,Industrials,True,6225.0,,United States,Industrial Machinery/Components
LEE,Lee Enterprises Incorporated Common Stock,Consumer Discretionary,True,6225.0,,United States,Newspapers/Magazines
LEG,Leggett & Platt Incorporated Common Stock,Consumer Discretionary,True,6225.0,,United States,Home Furnishings
LEN,Lennar Corporation Class A Common Stock,Consumer Discretionary,True,6225.0,,United States,Homebuilding
LEO,BNY Mellon Strategic Municipals Inc. Common Stock,Finance,True,6225.0,1987.0,United States,Trusts Except Educational Religious and Charitable
LEU,Centrus Energy Corp. Class A Common Stock,Industrials,True,6225.0,2014.0,United States,Mining & Quarrying of Nonmetallic Minerals (No Fuels)
LFCR,Lifecore Biomedical Inc. Common Stock,Health Care,True,6225.0,,United States,Biotechnology: Pharmaceutical Preparations
LFUS,Littelfuse Inc. Common Stock,Energy,True,6225.0,,United States,Electrical Products
LFVN,Lifevantage Corporation Common Stock (Delaware),Health Care,True,6225.0,,United States,Biotechnology: Pharmaceutical Preparations
LGL,LGL Group Inc. (The) Common Stock,Technology,True,6225.0,1946.0,United States,Industrial Machinery/Components
LGND,Ligand Pharmaceuticals Incorporated Common Stock,Health Care,True,6225.0,,United States,Biotechnology: Pharmaceutical Preparations
LH,Labcorp Holdings Inc. Common Stock,Health Care,True,6225.0,,United States,Medical Specialities
LHX,L3Harris Technologies Inc. Common Stock,Industrials,True,6225.0,,United States,Industrial Machinery/Components
LII,Lennox International Inc. Common Stock,Industrials,True,6225.0,1999.0,United States,Industrial Machinery/Components
LIN,Linde plc Ordinary Shares,Industrials,True,6225.0,,United States,Major Chemicals
LKFN,Lakeland Financial Corporation Common Stock,Finance,True,6225.0,,United States,Major Banks
LLY,Eli Lilly and Company Common Stock,Health Care,True,6225.0,,United States,Biotechnology: Pharmaceutical Preparations
LMT,Lockheed Martin Corporation Common Stock,Industrials,True,6225.0,,United States,Military/Government/Technical
LNC,Lincoln National Corporation Common Stock,Finance,True,6225.0,,United States,Life Insurance
LNG,Cheniere Energy Inc. Common Stock,Utilities,True,6225.0,2001.0,United States,Oil/Gas Transmission
LNN,Lindsay Corporation Common Stock,Industrials,True,6225.0,,United States,Industrial Machinery/Components
LNT,Alliant Energy Corporation Common Stock,Utilities,True,6225.0,,United States,Power Generation
LNW,Light & Wonder Inc. Common Stock,Technology,True,6225.0,,United States,EDP Services
LOAN,Manhattan Bridge Capital Inc,Real Estate,True,6225.0,,United States,Real Estate Investment Trusts
LOGI,Logitech International S.A. Ordinary Shares,Technology,True,6225.0,1997.0,United States,Computer peripheral equipment
LOW,Lowe's Companies Inc. Common Stock,Consumer Discretionary,True,6225.0,,United States,RETAIL: Building Materials
LPTH,LightPath Technologies Inc. Class A Common Stock,Technology,True,6225.0,1996.0,United States,Semiconductors
LPX,Louisiana-Pacific Corporation Common Stock,Basic Materials,True,6225.0,,United States,Forest Products
LRCX,Lam Research Corporation Common Stock,Technology,True,6225.0,1984.0,United States,Industrial Machinery/Components
LSAK,Lesaka Technologies Inc. Common Stock,Finance,True,6225.0,,South Africa,Investment Bankers/Brokers/Service
LSCC,Lattice Semiconductor Corporation Common Stock,Technology,True,6225.0,,United States,Semiconductors
LSTA,Lisata Therapeutics Inc. Common Stock,Health Care,True,6225.0,,United States,Misc Health and Biotechnology Services
LSTR,Landstar System Inc. Common Stock,Industrials,True,6225.0,1993.0,United States,Trucking Freight/Courier Services
LTC,LTC Properties Inc. Common Stock,Real Estate,True,6225.0,,United States,Real Estate Investment Trusts
LUMN,Lumen Technologies Inc. Common Stock,Telecommunications,True,6225.0,,United States,Telecommunications Equipment
LUV,Southwest Airlines Company Common Stock,Consumer Discretionary,True,6225.0,,United States,Air Freight/Delivery Services
LWAY,Lifeway Foods Inc. Common Stock,Consumer Staples,True,6225.0,,United States,Packaged Foods
LXP,LXP Industrial Trust Common Stock (Maryland REIT),Real Estate,True,6225.0,,United States,Real Estate Investment Trusts
LXU,LSB Industries Inc. Common Stock,Industrials,True,6225.0,2003.0,United States,Major Chemicals
LYTS,LSI Industries Inc. Common Stock,Consumer Discretionary,True,6225.0,1985.0,United States,Building Products
LZB,La-Z-Boy Incorporated Common Stock,Consumer Discretionary,True,6225.0,,United States,Home Furnishings
M,Macy's Inc Common Stock,Consumer Discretionary,True,6225.0,,United States,Department/Specialty Retail Stores
MAA,Mid-America Apartment Communities Inc. Common Stock,Real Estate,True,6225.0,1994.0,United States,Real Estate Investment Trusts
MAC,Macerich Company (The) Common Stock,Real Estate,True,6225.0,1994.0,United States,Real Estate Investment Trusts
MAN,ManpowerGroup Common Stock,Consumer Discretionary,True,6225.0,,United States,Professional Services
MANH,Manhattan Associates Inc. Common Stock,Technology,True,6225.0,1998.0,United States,Computer Software: Prepackaged Software
MAR,Marriott International Class A Common Stock,Consumer Discretionary,True,6225.0,,United States,Hotels/Resorts
MARPS,Marine Petroleum Trust Units of Beneficial Interest,Energy,True,6225.0,,United States,Oil & Gas Production
MAS,Masco Corporation Common Stock,Industrials,True,6225.0,,United States,Industrial Specialties
MAT,Mattel Inc. Common Stock,Consumer Discretionary,True,6225.0,,United States,Recreational Games/Products/Toys
MATV,Mativ Holdings Inc. Common Stock,Basic Materials,True,6225.0,,United States,Paper
MATW,Matthews International Corporation Class A Common Stock,Telecommunications,True,6225.0,1994.0,United States,Metal Fabrications
MATX,Matson Inc. Common Stock,Consumer Discretionary,True,6225.0,,United States,Marine Transportation
MBI,MBIA Inc. Common Stock,Finance,True,6225.0,1987.0,United States,Property-Casualty Insurers
MBOT,Microbot Medical Inc. Common Stock,Health Care,True,6225.0,,Israel,Biotechnology: Biological Products (No Diagnostic Substances)
MBWM,Mercantile Bank Corporation Common Stock,Finance,True,6225.0,1998.0,United States,Major Banks
MCD,McDonald's Corporation Common Stock,Consumer Discretionary,True,6225.0,,United States,Restaurants
MCHP,Microchip Technology Incorporated Common Stock,Technology,True,6225.0,1993.0,United States,Semiconductors
MCI,Barings Corporate Investors Common Stock,Finance,True,6225.0,,United States,Trusts Except Educational Religious and Charitable
