Symbol,Company_Name,Sector,Data_Exising,History_Existing
IRBT,iRobot Corporation Common Stock,Consumer Discretionary,True,4753.0
IRDM,Iridium Communications Inc Common Stock,Telecommunications,True,4161.0
IREN,Iris Energy Limited Ordinary Shares,Technology,True,720.0
IRIX,IRIDEX Corporation Common Stock,Health Care,True,6225.0
IRM,Iron Mountain Incorporated (Delaware)Common Stock REIT,Real Estate,True,6225.0
IRMD,iRadimed Corporation Common Stock,Health Care,True,2570.0
IRON,Disc Medicine Inc. Common Stock,Health Care,True,1040.0
IROQ,IF Bancorp Inc. Common Stock,Finance,True,3329.0
IRS,IRSA Inversiones Y Representaciones S.A. Global Depositary Shares (Each representing ten shares of Common Stock),Real Estate,True,6225.0
IRT,Independence Realty Trust Inc. Common Stock,Real Estate,True,2802.0
IRTC,iRhythm Technologies Inc. Common Stock,Health Care,True,1998.0
IRWD,Ironwood Pharmaceuticals Inc. Class A Common Stock,Health Care,True,3689.0
ISD,PGIM High Yield Bond Fund Inc.,Finance,True,3126.0
ISDR,Issuer Direct Corporation Common Stock,Consumer Discretionary,True,4201.0
ISPC,iSpecimen Inc. Common Stock,Health Care,True,827.0
ISPO,Inspirato Incorporated Class A Common Stock,Finance,True,916.0
ISPOW,Inspirato Incorporated Warrant,Finance,True,916.0
ISPR,Ispire Technology Inc. Common Stock,Health Care,True,375.0
ISRG,Intuitive Surgical Inc. Common Stock,Health Care,True,6110.0
ISRL,Israel Acquisitions Corp Class A Ordinary Shares,Finance,True,400.0
ISSC,Innovative Solutions and Support Inc. Common Stock,Technology,True,6076.0
ISTR,Investar Holding Corporation Common Stock,Finance,True,2580.0
IT,Gartner Inc. Common Stock,Consumer Discretionary,True,6225.0
ITCI,Intra-Cellular Therapies Inc. Common Stock,Health Care,True,2701.0
ITGR,Integer Holdings Corporation Common Stock,Health Care,True,6037.0
ITI,Iteris Inc. Common Stock,Telecommunications,True,6225.0
ITIC,Investors Title Company Common Stock,Finance,True,6225.0
ITOS,iTeos Therapeutics Inc. Common Stock,Health Care,True,1053.0
ITP,IT Tech Packaging Inc. Common Stock,Consumer Discretionary,True,4279.0
ITRG,Integra Resources Corp. Common Shares,Basic Materials,True,1048.0
ITRI,Itron Inc. Common Stock,Industrials,True,6225.0
ITRM,Iterum Therapeutics plc Ordinary Share,Health Care,True,1597.0
ITRN,Ituran Location and Control Ltd. Ordinary Shares,Technology,True,4783.0
ITT,ITT Inc. Common Stock ,Industrials,True,6225.0
ITUB,Itau Unibanco Banco Holding SA American Depositary Shares (Each repstg 500 Preferred shares),Finance,True,5689.0
ITW,Illinois Tool Works Inc. Common Stock,Industrials,True,6225.0
IVA,Inventiva S.A. American Depository Shares,Health Care,True,1063.0
IVAC,Intevac Inc. Common Stock,Technology,True,6225.0
IVCA,Investcorp India Acquisition Corp. Class A Ordinary Share,Finance,True,566.0
IVCB,Investcorp Europe Acquisition Corp I Class A Ordinary Shares,Finance,True,664.0
IVCP,Swiftmerge Acquisition Corp. Class A Ordinary Share,Finance,True,655.0
IVDA,Iveda Solutions Inc. Common Stock,Technology,True,3767.0
IVP,Inspire Veterinary Partners Inc. Class A Common Stock,Consumer Staples,True,273.0
IVR,INVESCO MORTGAGE CAPITAL INC Common Stock,Real Estate,True,3838.0
IVT,InvenTrust Properties Corp. Common Stock,Real Estate,True,2666.0
IVVD,Invivyd Inc. Common Stock,Health Care,True,792.0
IVZ,Invesco Ltd Common Stock,Finance,True,6225.0
IX,Orix Corp Ads Common Stock,Finance,True,6225.0
IXAQ,IX Acquisition Corp. Class A Ordinary Share,Finance,True,712.0
IXHL,Incannex Healthcare Inc. Common Stock,Health Care,True,649.0
IZEA,IZEA Worldwide Inc. Common Stock,Consumer Discretionary,True,3180.0
IZM,ICZOOM Group Inc. Class A Ordinary Shares,Consumer Discretionary,True,389.0
J,Jacobs Solutions Inc. Common Stock,Industrials,True,6225.0
JACK,Jack In The Box Inc. Common Stock,Consumer Discretionary,True,6225.0
JAGX,Jaguar Health Inc. Common Stock,Health Care,True,2363.0
JAKK,JAKKS Pacific Inc. Common Stock,Consumer Discretionary,True,6225.0
JAMF,Jamf Holding Corp. Common Stock,Technology,True,1055.0
JANX,Janux Therapeutics Inc. Common Stock,Health Care,True,831.0
JAZZ,Jazz Pharmaceuticals plc Common Stock (Ireland),Health Care,True,4363.0
JBGS,JBG SMITH Properties Common Shares ,Real Estate,True,1821.0
JBHT,J.B. Hunt Transport Services Inc. Common Stock,Industrials,True,6225.0
JBI,Janus International Group Inc. Common Stock,Industrials,True,1201.0
JBK,Lehman ABS 3.50 3.50% Adjustable Corp Backed Tr Certs GS Cap I,Finance,True,5157.0
JBL,Jabil Inc. Common Stock,Technology,True,6225.0
JBLU,JetBlue Airways Corporation Common Stock,Consumer Discretionary,True,5656.0
JBSS,John B. Sanfilippo & Son Inc. Common Stock,Consumer Staples,True,6225.0
JBT,John Bean Technologies Corporation Common Stock,Industrials,True,4076.0
JCE,Nuveen Core Equity Alpha Fund Common Shares of Beneficial Interest,Finance,True,4408.0
JCI,Johnson Controls International plc Ordinary Share,Industrials,True,6225.0
JCSE,JE Cleantech Holdings Limited Ordinary Shares,Consumer Discretionary,True,613.0
JCTCF,Jewett-Cameron Trading Company Common Shares,Consumer Discretionary,True,6225.0
JD,JD.com Inc. American Depositary Shares,Consumer Discretionary,True,2607.0
JDZG,JIADE LIMITED Common stock,Real Estate,True,95.0
JEF,Jefferies Financial Group Inc. Common Stock,Finance,True,6225.0
JELD,JELD-WEN Holding Inc. Common Stock,Basic Materials,True,1931.0
JEQ,abrdn Japan Equity Fund Inc. Common Stock,Consumer Discretionary,True,6225.0
JFBR,Jeffs' Brands Ltd Ordinary Shares,Consumer Discretionary,True,526.0
JFIN,Jiayin Group Inc. American Depositary Shares,Finance,True,1357.0
JFR,Nuveen Floating Rate Income Fund Common Stock,Finance,True,5164.0
JFU,9F Inc. American Depositary Shares,Finance,True,1290.0
JG,Aurora Mobile Limited American Depositary Shares,Technology,True,1555.0
JGH,Nuveen Global High Income Fund Common Shares of Beneficial Interest,Finance,True,2478.0
JHG,Janus Henderson Group plc Ordinary Shares,Finance,True,1847.0
JHI,John Hancock Investors Trust Common Stock,Finance,True,6225.0
JHS,John Hancock Income Securities Trust Common Stock,Finance,True,6225.0
JHX,James Hardie Industries plc American Depositary Shares (Ireland),Industrials,True,5774.0
JILL,J. Jill Inc. Common Stock,Consumer Discretionary,True,1903.0
JJSF,J & J Snack Foods Corp. Common Stock,Consumer Staples,True,6225.0
JKHY,Jack Henry & Associates Inc. Common Stock,Technology,True,6225.0
JKS,JinkoSolar Holding Company Limited American Depositary Shares (each representing 4 Common Shares),Technology,True,3619.0
JL,J-Long Group Limited Ordinary Shares,Consumer Discretionary,True,173.0
JLL,Jones Lang LaSalle Incorporated Common Stock,Finance,True,6225.0
JLS,Nuveen Mortgage and Income Fund,Finance,True,3734.0
JMIA,Jumia Technologies AG American Depositary Shares each representing two Ordinary Shares,Consumer Discretionary,True,1376.0
JMM,Nuveen Multi-Market Income Fund (MA),Finance,True,6225.0
JMSB,John Marshall Bancorp Inc. Common Stock,Finance,True,1908.0
JNJ,Johnson & Johnson Common Stock,Health Care,True,6225.0
JNPR,Juniper Networks Inc. Common Stock,Telecommunications,True,6225.0
JNVR,Janover Inc. Common Stock,Finance,True,299.0
JOB,GEE Group Inc. Common Stock,Consumer Discretionary,True,6225.0
JOBY,Joby Aviation Inc. Common Stock,Industrials,True,978.0
JOE,St. Joe Company (The) Common Stock,Real Estate,True,6225.0
JOF,Japan Smaller Capitalization Fund Inc Common Stock,Finance,True,6225.0
JOUT,Johnson Outdoors Inc. Class A Common Stock,Consumer Discretionary,True,6225.0
JPC,Nuveen Preferred & Income Opportunities Fund,Finance,True,5413.0
JPI,Nuveen Preferred Securities & Income Opportunities Fund Common Shares,Finance,True,3063.0
JPM,JP Morgan Chase & Co. Common Stock,Finance,True,6225.0
JQC,Nuveen Credit Strategies Income Fund Shares of Beneficial Interest,Finance,True,5352.0
JRI,Nuveen Real Asset Income and Growth Fund Common Shares of Beneficial Interest,Finance,True,3126.0
JRS,Nuveen Real Estate Income Fund Common Shares of Beneficial Interest,Finance,True,5754.0
JRSH,Jerash Holdings (US) Inc. Common Stock,Consumer Discretionary,True,1612.0
JRVR,James River Group Holdings Ltd. Common Shares,Finance,True,2465.0
JSM,Navient Corporation 6% Senior Notes due December 15 2043,Finance,True,5223.0
JSPR,Jasper Therapeutics Inc. Common Stock,Health Care,True,1188.0
JTAI,Jet.AI Inc. Common Stock,Consumer Discretionary,True,752.0
JVA,Coffee Holding Co. Inc. Common Stock,Consumer Staples,True,4886.0
JWEL,Jowell Global Ltd. Ordinary Shares,Consumer Discretionary,True,891.0
JWN,Nordstrom Inc. Common Stock,Consumer Discretionary,True,6225.0
JWSM,Jaws Mustang Acquisition Corp. Class A Ordinary Shares,Finance,True,884.0
JXJT,JX Luxventure Limited Common Stock,Consumer Staples,True,2912.0
JXN,Jackson Financial Inc. Class A Common Stock ,Finance,True,774.0
JYD,Jayud Global Logistics Limited Class A Ordinary Shares,Consumer Discretionary,True,362.0
JZ,Jianzhi Education Technology Group Company Limited American Depositary Shs,Real Estate,True,526.0
JZXN,Jiuzi Holdings Inc. Ordinary Shares,Consumer Discretionary,True,848.0
K,Kellanova Common Stock,Consumer Staples,True,6225.0
KACL,Kairous Acquisition Corp. Limited Ordinary Shares,Finance,True,676.0
KAI,Kadant Inc Common Stock,Industrials,True,6225.0
KALA,KALA BIO Inc. Common Stock,Health Care,True,1811.0
KALU,Kaiser Aluminum Corporation Common Stock,Industrials,True,4589.0
KALV,KalVista Pharmaceuticals Inc. Common Stock,Health Care,True,2386.0
KAPA,Kairos Pharma Ltd. Common Stock,Health Care,True,11.0
KAR,OPENLANE Inc. Common Stock,Consumer Discretionary,True,3724.0
KARO,Karooooo Ltd. Ordinary Shares,Technology,True,880.0
KAVL,Kaival Brands Innovations Group Inc. Common Stock,Consumer Discretionary,True,937.0
KB,KB Financial Group Inc,Finance,True,5758.0
KBH,KB Home Common Stock,Consumer Discretionary,True,6225.0
KBR,KBR Inc. Common Stock,Industrials,True,4496.0
KC,Kingsoft Cloud Holdings Limited American Depositary Shares,Technology,True,1106.0
KD,Kyndryl Holdings Inc. Common Stock,Technology,True,738.0
KDLY,Kindly MD Inc. Common Stock,Health Care,True,84.0
KDP,Keurig Dr Pepper Inc. Common Stock,Consumer Staples,True,4128.0
KE,Kimball Electronics Inc. Common Stock,Technology,True,2493.0
KELYA,Kelly Services Inc. Class A Common Stock,Consumer Discretionary,True,6225.0
KELYB,Kelly Services Inc. Class B Common Stock,Consumer Discretionary,True,6225.0
KEN,Kenon Holdings Ltd. Ordinary Shares,Utilities,True,2443.0
KEP,Korea Electric Power Corporation Common Stock,Utilities,True,6225.0
KEQU,Kewaunee Scientific Corporation Common Stock,Industrials,True,6225.0
KEX,Kirby Corporation Common Stock,Consumer Discretionary,True,6225.0
KEY,KeyCorp Common Stock,Finance,True,6225.0
KEYS,Keysight Technologies Inc. Common Stock,Industrials,True,2503.0
KF,Korea Fund Inc. (The) New Common Stock,Finance,True,6225.0
KFFB,Kentucky First Federal Bancorp Common Stock,Finance,True,4928.0
KFRC,Kforce Inc. Common Stock,Consumer Discretionary,True,6225.0
KFS,Kingsway Financial Services Inc. Common Stock (DE),Finance,True,5842.0
KFY,Korn Ferry Common Stock,Consumer Discretionary,True,6225.0
KGC,Kinross Gold Corporation Common Stock,Basic Materials,True,6225.0
KGEI,Kolibri Global Energy Inc. Common stock,Energy,True,3709.0
KGS,Kodiak Gas Services Inc. Common Stock,Utilities,True,316.0
KHC,The Kraft Heinz Company Common Stock,Consumer Staples,True,2326.0
KIDS,OrthoPediatrics Corp. Common Stock,Health Care,True,1751.0
KIM,Kimco Realty Corporation (HC) Common Stock,Real Estate,True,6225.0
KIND,Nextdoor Holdings Inc. Class A Common Stock,Technology,True,727.0
KINS,Kingstone Companies Inc. Common Stock,Finance,True,6225.0
KIO,KKR Income Opportunities Fund Common Shares,Finance,True,2814.0
KIRK,Kirkland's Inc. COMMONSTOCK,Consumer Discretionary,True,5581.0
KITT,Nauticus Robotics Inc. Common stock,Industrials,True,794.0
KKR,KKR & Co. Inc. Common Stock,Finance,True,3577.0
KLAC,KLA Corporation Common Stock,Technology,True,6225.0
KLG,WK Kellogg Co Common Stock,Consumer Staples,True,251.0
KLIC,Kulicke and Soffa Industries Inc. Common Stock,Technology,True,6225.0
KLTO,Klotho Neurosciences Inc. Common Stock,Health Care,True,608.0
KLTR,Kaltura Inc. Common Stock,Technology,True,804.0
KLXE,KLX Energy Services Holdings Inc. Common Stock,Energy,True,1531.0
KMB,Kimberly-Clark Corporation Common Stock,Consumer Discretionary,True,6225.0
KMDA,Kamada Ltd. Ordinary Shares,Health Care,True,2853.0
KMI,Kinder Morgan Inc. Common Stock,Utilities,True,3430.0
KMPB,Kemper Corporation 5.875% Fixed-Rate Reset Junior Subordinated Debentures due 2062,Finance,True,639.0
KMPR,Kemper Corporation,Finance,True,6225.0
KMT,Kennametal Inc. Common Stock,Industrials,True,6225.0
KMX,CarMax Inc,Consumer Discretionary,True,6225.0
KN,Knowles Corporation Common Stock,Consumer Staples,True,2674.0
KNDI,Kandi Technologies Group Inc. Ordinary Shares,Consumer Discretionary,True,4298.0
KNF,Knife Riv Holding Co. Common Stock,Industrials,True,332.0
KNOP,KNOT Offshore Partners LP Common Units representing Limited Partner Interests,Consumer Discretionary,True,2889.0
KNSA,Kiniksa Pharmaceuticals International plc Class A Ordinary Shares,Health Care,True,1597.0
KNSL,Kinsale Capital Group Inc. Common Stock,Finance,True,2057.0
KNTK,Kinetik Holdings Inc. Class A Common Stock,Utilities,True,1478.0
KNW,Know Labs Inc. Common Stock,Industrials,True,4645.0
KNX,Knight-Swift Transportation Holdings Inc.,Industrials,True,6225.0
KO,Coca-Cola Company (The) Common Stock,Consumer Staples,True,6225.0
KOD,Kodiak Sciences Inc Common Stock,Health Care,True,1506.0
KODK,Eastman Kodak Company Common New,Consumer Discretionary,True,2774.0
KOF,Coca Cola Femsa S.A.B. de C.V.  American Depositary Shares each representing 10 Units (each Unit consists of 3 Series B Shares and 5 Series L Shares),Consumer Staples,True,6225.0
KOP,Koppers Holdings Inc. Common Stock,Basic Materials,True,4697.0
KOPN,Kopin Corporation Common Stock,Technology,True,6225.0
KORE,KORE Group Holdings Inc. Common Stock,Telecommunications,True,955.0
KOS,Kosmos Energy Ltd. Common Shares (DE),Energy,True,3369.0
KOSS,Koss Corporation Common Stock,Consumer Staples,True,6225.0
KPLT,Katapult Holdings Inc. Common Stock,Consumer Discretionary,True,1195.0
KPRX,Kiora Pharmaceuticals Inc.  Common Stock,Health Care,True,2423.0
KPTI,Karyopharm Therapeutics Inc. Common Stock,Health Care,True,2742.0
KR,Kroger Company (The) Common Stock,Consumer Staples,True,6225.0
KRC,Kilroy Realty Corporation Common Stock,Real Estate,True,6225.0
KREF,KKR Real Estate Finance Trust Inc. Common Stock,Real Estate,True,1863.0
KRG,Kite Realty Group Trust Common Stock,Real Estate,True,5068.0
KRKR,36Kr Holdings Inc. American Depositary Shares,Consumer Discretionary,True,1230.0
KRMD,KORU Medical Systems Inc. Common Stock (DE),Health Care,True,6225.0
KRNT,Kornit Digital Ltd. Ordinary Shares,Industrials,True,2390.0
KRNY,Kearny Financial Corp Common Stock,Finance,True,4933.0
KRO,Kronos Worldwide Inc Common Stock,Industrials,True,5237.0
KRON,Kronos Bio Inc. Common Stock,Health Care,True,999.0
KROS,Keros Therapeutics Inc. Common Stock,Health Care,True,1127.0
KRP,Kimbell Royalty Partners Common Units Representing Limited Partner Interests,Energy,True,1926.0
KRRO,Korro Bio Inc. Common Stock,Health Care,True,1256.0
KRT,Karat Packaging Inc. Common Stock,Industrials,True,871.0
KRUS,Kura Sushi USA Inc. Class A Common Stock,Consumer Discretionary,True,1300.0
KRYS,Krystal Biotech Inc. Common Stock,Health Care,True,1768.0
KSCP,Knightscope Inc. Class A Common Stock,Telecommunications,True,672.0
KSM,DWS Strategic Municipal Income Trust,Finance,True,6225.0
KSS,Kohl's Corporation Common Stock,Consumer Discretionary,True,6225.0
KT,KT Corporation Common Stock,Telecommunications,True,6225.0
KTB,Kontoor Brands Inc. Common Stock ,Consumer Discretionary,True,1346.0
KTCC,Key Tronic Corporation Common Stock,Technology,True,6225.0
KTF,DWS Municipal Income Trust,Finance,True,6225.0
KTH,Structures Products Cp 8% CorTS Issued by Peco Energy Cap Tr II Preferred Stock,Finance,True,5945.0
KTN,Structured Products Corp 8.205% CorTS 8.205% Corporate Backed Trust Securities (CorTS),Finance,True,5240.0
KTOS,Kratos Defense & Security Solutions Inc. Common Stock,Industrials,True,6225.0
KTRA,Kintara Therapeutics Inc. Common Stock,Health Care,True,2921.0
KTTA,Pasithea Therapeutics Corp. Common Stock,Health Care,True,765.0
KUKE,Kuke Music Holding Limited American Depositary Shares each representing one Ordinary Share,Real Estate,True,935.0
KULR,KULR Technology Group Inc. Common Stock,Technology,True,1560.0
KURA,Kura Oncology Inc. Common Stock,Health Care,True,2275.0
KVHI,KVH Industries Inc. Common Stock,Technology,True,6225.0
KVUE,Kenvue Inc. Common Stock,Consumer Discretionary,True,354.0
KVYO,Klaviyo Inc. Series A Common Stock,Technology,True,258.0
KW,Kennedy-Wilson Holdings Inc. Common Stock,Finance,True,4235.0
KWE,KWESST Micro Systems Inc. Common Stock,Technology,True,937.0
KWR,Quaker Houghton Common Stock,Industrials,True,6225.0
KXIN,Kaixin Holdings Ordinary Shares,Consumer Discretionary,True,1735.0
KYMR,Kymera Therapeutics Inc. Common Stock,Health Care,True,1033.0
KYN,Kayne Anderson Energy Infrastructure Fund Inc.,Finance,True,5036.0
KYTX,Kyverna Therapeutics Inc. Common Stock,Health Care,True,161.0
KZIA,Kazia Therapeutics Limited American Depositary Shares,Health Care,True,6225.0
KZR,Kezar Life Sciences Inc. Common Stock,Health Care,True,1579.0
L,Loews Corporation Common Stock,Finance,True,6225.0
LAB,Standard BioTools Inc. Common Stock,Industrials,True,3431.0
LAC,Lithium Americas Corp. Common Shares,Basic Materials,True,246.0
LAD,Lithia Motors Inc. Common Stock,Consumer Discretionary,True,6225.0
LADR,Ladder Capital Corp Class A Common Stock,Real Estate,True,2680.0
LAES,SEALSQ Corp Ordinary Shares,Technology,True,341.0
LAKE,Lakeland Industries Inc. Common Stock,Health Care,True,6225.0
LAMR,Lamar Advertising Company Class A Common Stock,Real Estate,True,6225.0
LANC,Lancaster Colony Corporation Common Stock,Consumer Staples,True,6225.0
LAND,Gladstone Land Corporation Common Stock,Real Estate,True,2938.0
LANDM,Gladstone Land Corporation 5.00% Series D Cumulative Term Preferred Stock,Real Estate,True,932.0
LANDO,Gladstone Land Corporation 6.00% Series B Cumulative Redeemable Preferred Stock,Real Estate,True,993.0
LANDP,Gladstone Land Corporation 6.00% Series C Cumulative Redeemable Preferred Stock,Real Estate,True,330.0
LANV,Lanvin Group Holdings Limited Ordinary Shares,Finance,True,893.0
LARK,Landmark Bancorp Inc. Common Stock,Finance,True,6225.0
LASR,nLIGHT Inc. Common Stock,Technology,True,1618.0
LATG,Chenghe Acquisition I Co. Class A Ordinary Shares,Finance,True,636.0
LAUR,Laureate Education Inc. Common Stock,Real Estate,True,1928.0
LAW,CS Disco Inc. Common Stock,Technology,True,804.0
LAZ,Lazard Inc. Common Stock,Finance,True,4884.0
LAZR,Luminar Technologies Inc.  Class A Common Stock,Consumer Discretionary,True,1390.0
LB,LandBridge Company LLC Class A Shares Representing Limited Liability Company Interests,Energy,True,65.0
LBPH,Longboard Pharmaceuticals Inc. Common Stock,Health Care,True,894.0
LBRDA,Liberty Broadband Corporation Class A Common Stock,Telecommunications,True,2492.0
LBRDK,Liberty Broadband Corporation Class C Common Stock,Telecommunications,True,2491.0
LBRDP,Liberty Broadband Corporation Series A Cumulative Redeemable Preferred Stock,Telecommunications,True,948.0
LBRT,Liberty Energy Inc. Class A common stock,Energy,True,1690.0
LBTYA,Liberty Global Ltd. Class A Common Shares,Telecommunications,True,5116.0
LBTYB,Liberty Global Ltd. Class B Common Shares,Telecommunications,True,5112.0
LBTYK,Liberty Global Ltd. Class C Common Shares,Telecommunications,True,4797.0
LC,LendingClub Corporation Common Stock,Finance,True,2466.0
LCFY,Locafy Limited Ordinary Share,Technology,True,632.0
LCID,Lucid Group Inc. Common Stock,Consumer Discretionary,True,1014.0
LCII,LCI Industries,Consumer Discretionary,True,6225.0
LCNB,LCNB Corporation Common Stock,Finance,True,6225.0
LCTX,Lineage Cell Therapeutics Inc. Common Stock,Health Care,True,6225.0
LCUT,Lifetime Brands Inc. Common Stock,Consumer Discretionary,True,6225.0
LCW,Learn CW Investment Corporation Class A Ordinary Shares,Finance,True,713.0
LDI,loanDepot Inc. Class A Common Stock,Finance,True,914.0
LDOS,Leidos Holdings Inc. Common Stock,Technology,True,4518.0
LDP,Cohen & Steers Limited Duration Preferred and Income Fund Inc.,Finance,True,3062.0
LDTC,LeddarTech Holdings Inc. Common Shares,Technology,True,903.0
LDWY,Lendway Inc. Common Stock (DE),Consumer Discretionary,True,6224.0
LE,Lands' End Inc. Common Stock,Consumer Discretionary,True,2651.0
LEA,Lear Corporation Common Stock,Consumer Discretionary,True,3747.0
LECO,Lincoln Electric Holdings Inc. Common Shares,Industrials,True,6225.0
LEDS,SemiLEDS Corporation Common Stock,Technology,True,3474.0
LEE,Lee Enterprises Incorporated Common Stock,Consumer Discretionary,True,6225.0
LEG,Leggett & Platt Incorporated Common Stock,Consumer Discretionary,True,6225.0
LEGH,Legacy Housing Corporation Common Stock (TX),Consumer Discretionary,True,1457.0
LEGN,Legend Biotech Corporation American Depositary Shares,Health Care,True,1087.0
LEN,Lennar Corporation Class A Common Stock,Consumer Discretionary,True,6225.0
LENZ,LENZ Therapeutics Inc. Common Stock,Health Care,True,821.0
LEO,BNY Mellon Strategic Municipals Inc. Common Stock,Finance,True,6225.0
LESL,Leslie's Inc. Common Stock,Consumer Discretionary,True,985.0
LEU,Centrus Energy Corp. Class A Common Stock,Industrials,True,6225.0
LEV,The Lion Electric Company Common Shares,Consumer Discretionary,True,1000.0
LEVI,Levi Strauss & Co Class A Common Stock,Consumer Discretionary,True,1392.0
LEXX,Lexaria Bioscience Corp. Common Stock,Health Care,True,935.0
LFCR,Lifecore Biomedical Inc. Common Stock,Health Care,True,6225.0
LFLY,Leafly Holdings Inc. Common Stock,Technology,True,1206.0
LFMD,LifeMD Inc. Common Stock,Health Care,True,4197.0
LFMDP,LifeMD Inc. 8.875% Series A Cumulative Perpetual Preferred Stock,Health Care,True,751.0
LFST,LifeStance Health Group Inc. Common Stock,Health Care,True,832.0
LFT,Lument Finance Trust Inc. Common Stock,Real Estate,True,2901.0
LFUS,Littelfuse Inc. Common Stock,Energy,True,6225.0
LFVN,Lifevantage Corporation Common Stock (Delaware),Health Care,True,6225.0
LFWD,Lifeward Ltd. Ordinary Shares,Health Care,True,2529.0
LGCB,Linkage Global Inc Ordinary Shares,Consumer Discretionary,True,192.0
LGCL,Lucas GC Limited Ordinary Shares,Technology,True,145.0
LGCY,Legacy Education Inc. Common Stock,Real Estate,True,3.0
LGHL,Lion Group Holding Ltd. American Depositary Share,Finance,True,1328.0
LGIH,LGI Homes Inc. Common Stock,Consumer Discretionary,True,2741.0
LGL,LGL Group Inc. (The) Common Stock,Technology,True,6225.0
LGMK,LogicMark Inc. Common Stock (NV),Health Care,True,2794.0
LGND,Ligand Pharmaceuticals Incorporated Common Stock,Health Care,True,6225.0
LGO,Largo Inc. Common Shares,Industrials,True,3633.0
LGVN,Longeveron Inc. Class A Common Stock,Health Care,True,913.0
LH,Labcorp Holdings Inc. Common Stock,Health Care,True,6225.0
LHX,L3Harris Technologies Inc. Common Stock,Industrials,True,6225.0
LI,Li Auto Inc. American Depositary Shares,Consumer Discretionary,True,1049.0
LICN,Lichen China Limited Class A Ordinary Shares,Consumer Discretionary,True,415.0
LICY,Li-Cycle Holdings Corp. Common Shares,Industrials,True,973.0
LIDR,AEye Inc. Class A Common Stock,Consumer Discretionary,True,936.0
LIDRW,AEye Inc. Warrant,Consumer Discretionary,True,937.0
LIFW,MSP Recovery Inc. Class A Common Stock,Technology,True,991.0
LIFWW,MSP Recovery Inc. Warrant,Technology,True,510.0
LII,Lennox International Inc. Common Stock,Industrials,True,6225.0
LILA,Liberty Latin America Ltd. Class A Common Stock,Telecommunications,True,2327.0
LILAK,Liberty Latin America Ltd. Class C Common Stock,Telecommunications,True,2334.0
LILM,Lilium NV Class A Ordinary Shares,Industrials,True,968.0
LILMW,Lilium N.V. Warrants,Industrials,True,968.0
LIN,Linde plc Ordinary Shares,Industrials,True,6225.0
LINC,Lincoln Educational Services Corporation Common Stock,Real Estate,True,4850.0
LIND,Lindblad Expeditions Holdings Inc. Common Stock,Consumer Discretionary,True,2830.0
LINE,Lineage Inc. Common Stock,Real Estate,True,47.0
LINK,Interlink Electronics Inc. Common Stock,Technology,True,5725.0
LION,Lionsgate Studios Corp. Common Shares,Consumer Discretionary,True,650.0
LIPO,Lipella Pharmaceuticals Inc. Common Stock,Health Care,True,447.0
LIQT,LiqTech International Inc. Common Stock,Technology,True,3291.0
LITB,LightInTheBox Holding Co. Ltd. American Depositary Shares each representing twelve ordinary shares,Consumer Discretionary,True,2849.0
LITE,Lumentum Holdings Inc. Common Stock,Telecommunications,True,2313.0
LITM,Snow Lake Resources Ltd. Common Shares,Basic Materials,True,718.0
LIVE,Live Ventures Incorporated Common Stock,Consumer Discretionary,True,5707.0
LIVN,LivaNova PLC Ordinary Shares,Health Care,True,2252.0
LIXT,Lixte Biotechnology Holdings Inc. Common Stock,Health Care,True,4261.0
LIXTW,Lixte Biotechnology Holdings Inc. Warrants,Health Care,True,965.0
LKCO,Luokung Technology Corp Ordinary Shares,Technology,True,1437.0
LKFN,Lakeland Financial Corporation Common Stock,Finance,True,6225.0
LKQ,LKQ Corporation Common Stock,Consumer Discretionary,True,5282.0
LLAP,Terran Orbital Corporation Common Stock,Industrials,True,864.0
LLY,Eli Lilly and Company Common Stock,Health Care,True,6225.0
LLYVA,Liberty Media Corporation Series A Liberty Live Common Stock,Industrials,True,285.0
LLYVK,Liberty Media Corporation Series C Liberty Live Common Stock,Industrials,True,289.0
LMAT,LeMaitre Vascular Inc. Common Stock,Health Care,True,4516.0
LMB,Limbach Holdings Inc. Common Stock,Consumer Discretionary,True,2553.0
LMFA,LM Funding America Inc. Common Stock,Finance,True,2210.0
LMND,Lemonade Inc. Common Stock,Finance,True,1068.0
LMNR,Limoneira Co Common Stock,Consumer Staples,True,5281.0
LMT,Lockheed Martin Corporation Common Stock,Industrials,True,6225.0
LNC,Lincoln National Corporation Common Stock,Finance,True,6225.0
